text,y
"I believe it is the voters who are to be judged on who they elect. The republican party provides a platform to libertarians. However, the voters do not resonate with the libertarian values (mainly due to religion).

The fact that the republican party provides a platform to libertarians is a reason why in my opinion it is much better than the democratic party.",0.4759100642398287
"i’m sorry, it is clear you are very mentally ill. believing the holocaust is fake, being racist as shit, and not believing in vaccinations are just some things that you share in common with trump supporters and conservatives. please seek help.",0.7767665952890792
Wait you guys have money?,0.30888650963597425
"on NA, grailed Medea to lv80 because she deserves a gold border.

on JPN, Berserker Nobu to 100 and I just finished leveling Hokusai to 100 as well. :) Waiting until I get 5 grails again so I can take King Hassan to 100 next..",0.38650963597430404
Pokémon leafgreen. First game I ever played.,0.18576017130620984
"Not just questions, if you just told me twenty minutes ago that you don't like a specific actor, if you tell me again in the same conversation I'm just gonna get pissed off. Yeah, you made your point, can we move the fuck on?",0.7880085653104925
They make a valid point. DNC really doesn't seem to give a fuck about Michigan.,0.8549250535331905
"The positive reinforcement is ""if you vaccinate your kids, you get the reward of fully benefiting from all the protections and privileges that society offers."" ",0.29764453961456105
"Actually it might. It will make investors more hesitant to invest in oil companies, because the likelihood of them getting any of their money back if it goes south will be practically nonexistent.",0.30888650963597425
Will they let us drink real beer then?,0.24143468950749467
"I don't think you understand. If a company goes bankrupt they don't have any say on where their money goes. Even if they wanted to sell their remaining assets and spend the money on clean-up, it wouldn't be allowed. From now on (in Canada) it will actually be mandatory.

That in turn scares off investors, because if the company they invest in goes bankrupt there is an even lower chance of them seeing any of their money back.",0.36456102783725913
"Are people who call ""fascist"" ""nazi"" at the slightest provocation insecure about their own totalitarian racist?",0.7660599571734475
"Married men can do whatever they like, they just have to live with the consequences. 

Same for married women, if, let's say, her husband has let himself go and she just doesn't fancy him any more for sex, but he's still useful for putting shelves up.

Wives do not 'allow' husbands to do things, and vice versa. Marriage is a partnership. If one side of that partnership is not happy with an aspect of it, they need to discuss it.

If one partner (wife or husband) wants to sleep with other people, and the other is ok with it then fine. 

But it must be agreed by both parties otherwise the 'harm' is simply transferred from one party to the other. I would argue it's easier for a man to not have sex than it is for a woman to cope with a cheating husband.",0.5315845824411135
"Same Reason as trump really.

Horrible baby boomers hating foreigners so much they don't care if it economically ruins them.
",0.6097430406852248
What a day for the foreign secretary to resign 🤔,0.3276231263383298
Way too soon. At 14. In november i'm turning 27 and my grandfather isn't as bald as i am.,0.29764453961456105
"Which one, the dunce cap or the klan cap?",0.5428265524625268
"agreed! One time, then run for your life",0.23072805139186298
I can say that you can't give blood if you've ever spent more than 72hrs in prison,0.3420770877944325
"The gay will kill em faster than measles

/s",0.7767665952890792
Beautiful. Just beautiful. His sincerity is apparent both from the writing style and lack of spelling errors.,0.18576017130620984
"Why fuck does a person is allow to buy unlimited amount of guns. I seen on the news arrested a guy for something else, but he had like 60 or more guns.....  He didn't even have any of guns locked in a safe. It was just hoarded all over his house.  Shouldn't we pass laws to allow only one gun per person?  Every fucking mass shooting you hear the gun was stolen. Like can you please fine these people for not locking away there gun in a safe? WTF is lazy piece of shit congress doing?",0.8950749464668093
I wouldn't be surprised if the circle that contains all flat earthers HEAVILY overlaps with anti-vaxxers fwiw. Same logic. Just one doesn't kill.,0.6654175588865096
"Thorin and his controversial opinions, name a more iconic duo than this.",0.3977516059957173
"When/how did that happen? Legitimately curious about it, especially if there are (non conspiracy theorist) sources.",0.31959314775160597
Oh man this is making me actually mad. ,0.4646680942184154
"From what I know, Healthcare does not have any traditional market forces which are needed for the free market. Education is a terribly broken market. It's close to impossible fixing badly shattered things. ",0.38650963597430404
"I voted for Trump, I think words like ""white nationalism"" and ""white supremacy"" and ""racist"" and ""nazi"" get trotted out way to much as a cheap rhetorical ploy.  I've seen the tapes and I don't think that Donald Trump has ever admitted on camera to hating muslims or latinos.  I saw this headline and assumed it was more liberal bullshit. 

But no, that's fucking white nationalism.  That's unabashed white nationalism, racism, white supremacy.  Laura Ingraham is a racist.  I can't believe that aired on television, I'm horrified.  ",0.7548179871520343
"Poor Kellyanne. Like a zookeeper in front of the monkey exhibit calmly explaining that her monkeys would never fling poo, and meanwhile there's a monkey behind her flinging poo. ",0.5091006423982869
"Those are small, reasonable changes. Except for bathroom signs - do you want a third sign, and a third bathroom for non-binary people? In that case, sure. That would cost in infrastructure, however. However, if you're saying we should remove (male/female) bathrooms into just one gender neutral bathroom, that's already implemented in several countries for a long time (I personally disagree with it) or do you mean creating 83 more bathrooms for all genders? That's too much a waste of money. 

I was mostly talking of how people are advocating to change the medical system, how they can tell doctors what they identify as and doctors don't have the right to ask what their real sex or gender is. There are other systems, but I only recall this one at the moment :/

",0.5315845824411135
"Ok, it appears my understanding of the laws surrounding vaccines were flawed. This does not change my view though. I know believe it should be mandatory to vaccinate, at least for a few major diseases, and my original belief still holds.
",0.38650963597430404
"Plot twist, your lemonade is a hit and everybody loves it. Suddenly, you have a “Springtime for Hitler” situation on your hands.",0.5091006423982869
"What I'm doubting right now is whether this administration is abnormal, or if it's the true face of the Republicans and all that talk about liberty was empty.  Like I've been saying, economic liberty and nothing else.

And what confuses me is that most people support the majority those of civil liberties.  Even most Republicans voters support marijuana decriminalization, so the lawmakers could pass a law like that with very little blowback.  And nearly everyone supports offering protection to the Dreamers.",0.5091006423982869
"**Budge**t - $60  
**Source** - Bluetooth from Iphone 4s  
**Requirements for Isolation** - Not sure. Will use in outdoor gym, maybe for running. Maybe..  
**Will you be using these Headphones in Public?** Not really too much. Maybe running (maybe)  
**Preferred Type of Headphone** - Full Sized
**Preferred tonal balance** - Balanced  
**Past headphones** - N/A
**Preferred Music** - Probably workout music, so I guess more like metal, but I actually love Nujabes too so.  
**What would you like to improve on from your set-up** - Just over ear, good for working out, no whistles/bells.   ",0.29764453961456105
Get the fuck out of here.,0.8517130620985012
"I obviously know that. It is a satire because ""these"" (antivaxxers) people actually do write like that.",0.4646680942184154
"I haven’t seen evidence of that yet.  I’ll hold judgement until 2020.  So far, I’m pretty thrilled with his performance.  Yes, we have to deal with his YUGE ego and silly tweeting, but foreign-policy wise, he’s killing it.  Domestically, he’s killing it.  The only thing he needs is to get congress in line.  That’s why midterm elections are going to be so important for all sides.  The DNC needs to prevent Trump from getting a real majority and Trump needs to get more like-minded people in the GOP.  It’s why a lot of politicians will probably get beaten in the primaries.  ",0.5985010706638114
I need a bottle of a different kind after listening to their crap.,0.5899357601713062
You don't need to deflect it. Just straight up get hit by hit. It won't hurt you unless you touch the ground. Then attack.,0.38650963597430404
So they are tax exempt and law exempt. It's can't be that easy.,0.23661670235546037
"Imagine this practice has already been enacted - no shooter's identity or image is ever released. The copycat will still know them as the Pulse Nightclub shooter who killed 50 people or the Las Vegas shooter who killed 58 people.

What difference does knowing one's identity make to a potential copycat? I can't imagine this being as effective as you think it will be. The news will report locations and casualty totals and that's really what is remembered after a shooting.",0.5572805139186294
[deleted],0.36456102783725913
Holy Christ dude... defend yourself...,0.5203426124197001
"If you think the argument is meaningless then why engage in it? Especially when your opinion is obviously biased by the fact that you don't like marshmallows.

People who enjoy both can have an objective discussion about the merits and pitfalls of each. When you chime in and immediately say marshmallows are disgusting then you are obviously making only a subjective argument and thus YOUR argument is meaningless, not the argument on whole. ",0.55406852248394
Do you suppose that allowing girls into the Scouts will have a positive effect of getting soon-to-be women to better understand men rather than have the opposite influence of 'de-masculining' the Scouts?,0.4202355460385439
"Let's be honest, most of reddit would panic and die.",0.5203426124197001
Sure. It has to be an open understanding between the married couple that one partner requires a higher level of sex life than what the other is willing to provide.,0.49839400428265523
"22,000 nurses should be fired without a single penny severance or even that week’s paycheck ",0.566916488222698
"Mate, if you think kneeling has had zero effect on viewership, you're naive. The NFL **clearly** thinks kneeling is having an effect on viewership, **or they wouldn't be doing what they are doing.**",0.4989293361884368
All the GOP wants to do nowadays is point guns at people and take their stuff.,0.5315845824411135
"this is the type of man i want to marry

so, by saying that Ethan, if you see this hit me up ",0.29764453961456105
Wow! Congratulations on finding a loving respectful relationship! That can be a rare thing in someone’s life. Embrace it. There is no such thing as a normal role and even if there was and you’re comfortable with how your relationship is working then F normal! Good on you.,0.29764453961456105
people have the right to know what happened. they shouldnt be deprived of knowing what the shooter looks like and other  stuff,0.27516059957173444
"I've got to say, even having been prepared by the headline, that is a fucking weird cover.",0.7103854389721627
HA HA.  This is really a perfect moment for a Nelson Muntz laugh.,0.33083511777301927
"Certain vaccines cause shedding and immunocompromised people should not be around recently vaccinated people for this reason. A vaccinated person can get another person sick, so it would be impossible to prove and discriminatory to children who are not vaccinated. ",0.373661670235546
There should be a very real concern of the idea that Hamas is using Palestinian civilians blood to propagate global attention.,0.5653104925053534
people with Hutchinson-Gilford Progeria might beg to differ,0.36456102783725913
"just make it federal or state law in all 50 states that you must be vaccinated for major illnesses like measles

if you refuse you get hit with a massive fine and you are forcibly vaccinated by the state",0.4646680942184154
"I’m talking out of my ass here, but I would imagine the type of people living in an expensive condo are, in general, easier to be a landlord to? 

As in, they’re probably well off and less likely to not be able to pay, or cause issues etc. Then again, when they do cause an issue it costs a hell of a lot more.",0.7205567451820128
"This is why I quit going to the gym. I didn't understand how certain machines worked and If I tried to take a couple minutes to figure it out people would start scoffing or pull out a phone to take pictures of my mistake. Same for my fiancé, she only uses the treadmills because she is scared of using a machine wrong and getting yelled at.",0.4089935760171306
"No, option 40 is your bonus, especially as a GED.",0.31638115631691643
"> There's might still be moral people in such societies, but they usually end up with their heads on pikes to be shown off to their own daughters.

As long as most people are moral, this won't happen. If religious people were more likely to be moral, perhaps you would have a point. However, most religious people are moral and most atheist are moral, so this seems like a moot point. ",0.49839400428265523
It's an instant boner killer sadly.,0.5765524625267665
That delay makes me even more hyped! :P,0.14132762312633834
Uhh it says right there a DETECTIVE said it. Case closed sweaty.,0.5653104925053534
"I would say, get a property manager and forget about it for a while. Unless you want to live there. Real estate may plateau or drop, but that is also the case for the market. The fact is we're in an everything bubble.

If after a period of time it is still a source of stress for you, you can always sell and instead hold it in stocks/bonds. But it's nice to have the real estate as a source of diversification. In a sense, the condo is already invested.",0.3977516059957173
you can still be a faggot and not be gay my dude. don’t worry ,0.7767665952890792
"""I wanted a white Ipad not a silver one!!!!"" - my nephew screams at his parents at xmas. ",0.5342612419700213
"There would be no way to keep the shooter's (or multiple shooters) name out of the press.  And even if there were a way to arrest and/or prosecute them without it coming out, the details of the shooting are likely the thing that would generate a copycat shooting, not the shooter's name.",0.5872591006423983
"""top 10 anime betrayals""

.

.

.

wait",0.4089935760171306
">protect people from getting beaten up, stabbed, raped, etc.

To be fair, prisons already do this. It's not as if prisons openly encourage rape like ""welp, hey, you're in prison now so anything goes."" 

I think much of the rhetoric you hear is probably a scare tactic/deterrent to make people *really* not want to go to prison/break laws. ",0.6011777301927195
">He knows about a racist idea, that means he's a racist 

🤔",0.5985010706638114
Zombie fallout by Mark Tufo is about this very thing,0.38650963597430404
"Shishou lv 100. Waifu needs all the love.

As for the rest of my grails, I want to give them to Nitocris is, but I'm broke on sq, so that's a no. ",0.3849036402569593
"I disagree with your premise. If you go talk to the average American, you'll find that you have more in common than not. The Media knows that the US v. Them narrative is powerful, so they run with it. I love America, I'm a liberal, but I know that I simply have a different view of what America should be than your average Trump voter. I hope that they give me the same curtesy when critiquing my political inclinations.  ",0.4089935760171306
Greenland has already shut its ports months in advance ,0.30888650963597425
"You'll notice none of my reasons related to taste.  I also love whipped cream, but the practical aspects of using marshmallows over whipped cream make them superior.",0.38650963597430404
"Most people have sense. Most people understand quid pro quo enough to recognize it when they see it. Donald trump is so bad at it.

Edit: weird typo, I don't know what happened.",0.5091006423982869
Serbia doesn’t have extradition ,0.3977516059957173
"Nothing infuriates me more than this (well quite a few things honestly), but still...",0.33083511777301927
"I suppose they choose it in the same was that addicts ""choose"" to be addicts. ",0.430406852248394
There are specialists in that. I would defer to their judgment.,0.23661670235546037
"No. OP is arguing that the difference in incomes is not due to discrimination. Which is probably not completely true, but mostly true (maybe 1/5th of the difference being discrimination).",0.4534261241970021
Is she suggesting it to experiment with her sexuality or because she wants to spice things up? Because there's a real difference there.,0.40738758029978583
"Mark 10:25
“It is easier for a camel to go through the eye of a needle than for someone who is rich to enter the kingdom of God.""

He seemed to not think very highly of rich people to me. ",0.28640256959314775
"1. Be horny as fuck

2. Write about it

3. Rinse / repeat",0.7992505353319057
"Gratz dude! I beat him this morning! I tried him easy too many times this weekend, woke up this morning and farmed up some xp, bought ascending and descending carp, and finally kicked his ass!",0.6322269807280514
Well there are obvious reasons women aren't as open to ONS as men. There are just so many risk factors and not even rewards that make it worth it. ,0.38650963597430404
"Lots of those are the extremists. How exactly should those things change, according to what you've heard?",0.30888650963597425
"I'm a bit concerned that buildings shorter than 22 floors are allowed to have flammable outside bits.  My gut feeling, as a non builder, is that no building should have a flammable envelope.",0.36456102783725913
Is it legal to sell your own blood by the way?,0.43147751605995716
"Compared to the previous century, I think we're doing alright in the 2000s compared to 1900s so far on catastrophe.",0.27516059957173444
"Holy Gwyn, Lord of Cinder - it's amazing",0.15256959314775162
I’m sorry for your political party that needs Russian money and intelligence to run for office ,0.4427194860813704
Thats a pretty large what if you're throwing around.,0.30888650963597425
True enough but certainly it might make people suspicious of new orgs with big money.,0.2938972162740899
"You were pointing logical fallacies in OPs comment. I think under these circumstances you can be forgiven for being *pro-*incest, ya fucken *weirdo*.      
      
Oop...shit...sorry mate.       
I've got no idea where *that* came from ¯\\_(ツ)_/¯      
      
      
",0.7767665952890792
"If someone says ""no"" in most contexts, it should be respected no matter the reason. If you offer someone a drink, this is fine, but if they say ""no"" and you continue to pressure them into saying ""yes,"" you are doing a huge injustice. You are coercing them into doing something they said ""no"" to and this is morally wrong.",0.4089935760171306
"Yeah I got him my first time on the third stage as well, was not expecting it at all, no gourds or pellets left just on full health, desperate and frantic but so satisfying, keep falling in love with this game over and over 

Just wish there was a way to go back and do last boss fights again for practice, fighting Genichiro was super fun ",0.3752676659528908
"if you get distracted for some reason (urgent phone call, sudden house fire, etc.) you end up either with a soggy disgusting marshmallow, or creamy warm chocolate, which is still quite nice",0.2082441113490364
"Say the government puts a price cap on textbooks. You’d get lower textbook prices, sure. But many people who would write a textbook if they could sell it for $100 won’t do it if they now have to sell it for $50. Fewer textbooks written will mean that overall textbook quality will decline. I’m not sure how else you’d regulate textbooks. I suppose the government could subsidize them, but it basically already does in the form of student aid. I can make similar arguments for pretty much any regulatory scheme you throw at me. Lower quality, higher prices, or both.",0.3420770877944325
That is only how you start the game.,0.2082441113490364
"They are the enemy, you are more likely to be negatively affected by Trump administration than by North Korea. CMV.

Don't get me wrong, republicans think the same way. Obama was worse than Putin in their view. They actually admire Putin.",0.5872591006423983
JUST RUB SOME TUSSIN ON THERE!,0.29764453961456105
"Well I’m a human. Which is an animal... many humans breed even when they have genetic defects. Eugenics is exactly the forced prevention of specific people from breeding. In our context, those who find certain varieties of human superior, think those other forms have genetic defects... thus 

Eugenics is  also the presence of laws preventing defect based breeding (all of this is on a philosophical level just in case you take offense) yet we pretty much agree eugenics is bad. 

On a more real life example. The border collie is exceptionally smart. It was bred for specific traits, some of them come with defects. Yet it ended up making a magnificently efficient sheep herder. 

Good comes with the bad. Even if the word *selective* is *subjective*",0.55406852248394
"In his defense the adage is probably well documented. There are lots of movies and books that are based on this. That just does not mean it is a ""well documented fact""",0.3752676659528908
"Looking to get a good $150+ headphone that is over ear and closed. I have a pair of ATH-AD700x open backed and am looking for a closed back pair. (sorry if thats not correct terminology) 

I'm looking for a good pair to use at home as well as take with me to occupy my time on the train or planes. 

I'm looking at the ATH-MSR7's but I hear complains about lack of bass. 
Sony MDR1a I hear has bass but lacks sound quality compared to the MSR7's. 

Any other recommendations at that price point? 

Edit: I am in Japan so I will not have the same exact prices as US. ",0.2082441113490364
It's not exactly concurrent. It's 1.2 million active daily across both Xbox and PS.,0.27516059957173444
"I'm sorry, but have you *seen* a spiderweb? Or a spider building one? These are just big flies. ",0.31959314775160597
[deleted],0.41755888650963596
"The gist of my post was ""does it make sense to you? It conflicts with what we think/know of humankind."" So no source for that train of thought.",0.4646680942184154
Is this the same guy who thought negative numbers were invented by capitalists so they could put people in debt?,0.49839400428265523
Thorin doesn't know anything about CS other than stats its embarrassing ,0.487152034261242
"As a man, this is my ideal future. I don't see this as weird at all, and if anything this should be encouraged because reinforcing gender roles harms both men and women.",0.5326552462526766
Was this a post on Reddit or did everyone get this ad? I’m confused.,0.31959314775160597
"You are confirming his point here dude

This isn’t a liberal sub it’s world politics, why are you so mad",0.4427194860813704
"They're not banning them, the state just isn't funding them any more. There's also plenty of expensive drugs they don't fund that people have kicked up a fuss about in the past. ",0.49839400428265523
"Answers to interview questions are terrible and it's obvious they are answering poorly on purpose. Only one person has ever admitted they didn't want to get hired. I work in an area where about 2% of my interviews are this way, and that's high, so it doesn't happen too too much, but more than 0 is unacceptable to me. ",0.43147751605995716
Boo me? Fuck you! Get paid Al! ,0.8217344753747322
"Wow, if only there was some place we could find such information....",0.31959314775160597
Lol it’s kind of our lives to dig now eh?,0.28211991434689504
I will always see someone who doesn't view me as a person my enemy.,0.3420770877944325
"But gay men and lesbians can currently do those things in their respective bathrooms, so wouldn't it make more sense to have laws against loitering in bathrooms and doing those sorts of things rather than sex based segregation. Like, your entire argument seems predicated on the assumption that only heterosexual people exist.",0.6322269807280514
"When I was a kid I went to this family friends house and she pulled a jar of mayonnaise out of the fridge and ate a huge spoonful out of the jar.
I refused to go back to her house ",0.3688436830835118
"From what I can see, it'll be a huge step towards equality.
If, in addition, a method comes about that allows men to give birth, then women have a fighting chance in the world !",0.36456102783725913
Ah yes we are broke cuz of free vaccines,0.4759100642398287
