text,y
"My best ks 6:39
..gonna go in and start at 9 and hold it as long as I can then try to go up...hoping to beat 6:39!  You are amazing",0.21948608137044967
"Oh, now it’s not his stock market. He was lying between those two ears last month. If you like my stock market you can keep it!",0.3752676659528908
I love people using our religion to push their political agenda. If you want us to stay out of your business you better stay the hell away from ours.,0.5091006423982869
"> You are still confusing being critical of a nation's foreign policy as anti-semitism.

No I'm not, I'm saying that anti-semitism is a *potential motive* for being critical of a nation's foreign policy in regards to Israel.",0.5428265524625268
They just copied and pasted the Cleric Beast sounds into the Bat Demon boss. ,0.38650963597430404
"Unpaid internships also give school credit. Most interns are students. It sucks, but it's not all worthless. This very semester I had to juggle an internship, a job, and school and I was very tired but I live for these kind of challenges, plus my resume looks good now. It's all about playing the game until you get to the top.",0.3533190578158458
I think that guy in the end will fall in love with Nami. lol,0.22002141327623126
The numbers indicate how many mines are adjacent to the cell.  The goal is to mark all of them without clicking on a cell hiding a mine.,0.36456102783725913
Fuck this place im going to mars,0.8442184154175588
"The world record wolf, killed in Alberta, was 230 lbs. That wolf is bigger than you if you are an average American man. It has daggers for teeth. It can run 40 mph. This makes Ray Lewis look like a baby back bitch. Still think you can fight it bare handed? ",0.6209850107066381
"Come on man, I wish this sub actually had world politics and not just Trump 24/7",0.3977516059957173
I am definitely not a white knight. Idk what I am. Probably just a pawn haha,0.36456102783725913
Why don't they just use paper?,0.1638115631691649
NOOO SHIIIIT. access to birth control = less unwanted pregnancies. This isn't rocket science ,0.7767665952890792
He emailed breitbart saying he was fired,0.28211991434689504
you will be in panic too if you don't know where your towel is,0.3752676659528908
[deleted],0.5091006423982869
Many have said the US is subsidizing terrorism.,0.5224839400428265
"Since culture and race are two separate things, how would accepting ""culture appropration"" end racism?",0.4427194860813704
Can you read the article or is reading too difficult for you incels?,0.7376873661670236
I am 27 years old and have been starting to thin and recede over the past 3 years... :(,0.23072805139186298
Are you kidding? They literally kill their own kids,0.6654175588865096
"I bought a pocket knife for camping and now I use it at home probably once a week.  Mostly for opening boxes and cutting up the cardbord for recycling.  Also for opening bottles, and as a quick handy screwdriver.",0.24143468950749467
"Guns don't kill people.

People kill people.

Fix the people. 

Seriously, how long did it take Europe to figure this out? UNIVERSAL HEALTHCARE!",0.5765524625267665
Was he not violating his parole and a sex offender?  Shouldn't that be an indicator that LE should get involved?,0.4646680942184154
What have I missed between Iran and Israel?  I haven't really seen those 2 in the news together much,0.38650963597430404
"Ran a 5:35 mile, 22 sec PR from the May benchmark!",0.1311563169164882
"> I’m talking about regulations to profits to the companies with their hand in the cookie jar of medicine and education.

Employer-paid health insurance as a product was created as a response to the first time someone got this bright idea. During the Great Depression, FDR had the bright idea to set a cap on wages in the hopes that what couldn't be paid to highly productive employees would instead be paid to others. Instead what we got were benefits.

When you limit the number of 'cookies' that can be taken from the 'jar', all you do is create an incentive for another person to stick their hand in.",0.4759100642398287
"Despite only having one loss, Baylor will NOT be in the Top 25",0.3752676659528908
"Larry.
Fucking.
C O O K.",0.6879014989293363
no fucking clue but i dont work that day so yay!,0.766595289079229
"I found this part of the song sort of angering, Hitler was originally from Austria, most of the original people attracted were of Austrian descent, and Germany was forced to submit when many cities were held at gun point.
Most ethnic Germans in the military had their families threatened and held hostage to keep them fighting.

So in reality WW2 is Austrias fault.",0.5091006423982869
So YouTube comments qualify as World Politics nowadays?,0.31959314775160597
I got a credit card when I was 18. I was not ready for that kind of responsibility. ,0.27516059957173444
So anything which you cannot prove the existence of logically does not exist?,0.4089935760171306
Some colleges have troops for college age. Their focus is on community service and helping younger troops. Plus she's a registered lifer. ,0.3420770877944325
Does anyone pretend r/politics is anything but a mouthpiece for the Hillary campaign at this point? ,0.4089935760171306
"Come see the violence inherent in the system!!

Come see the violence inherent in the system!!",0.5203426124197001
Lol not gonna try and change your view on this one. You hit the nail on the head. Spot on.,0.2526766595289079
Oh man that’s a murder if I’ve ever seen one,0.4646680942184154
Can confirm. I’ve paid it before.,0.1300856531049251
I'm just 14 hours late to make this comment. Close.,0.2082441113490364
"Do you believe there's a chance they'll shift to a pro-liberty agenda?  If so, how will it happen when it appears most of the base doesn't support those ideas?",0.4759100642398287
">So does the person have to have sexual value to you in particular to be worthy of respect?

No but if you are going to have sex with someone then it's something they need to have.

&#x200B;",0.5899357601713062
"Not if they actually do all the charitable work that those people think they're donating to support. And if they're not doing it, and people choose not to donate just to fund the church itself, so what? That may be a perfectly reasonable choice.",0.4534261241970021
They had to leave your mom off the list because everyone was so aware of her that it compressed the y-axis until it was unusable.,0.4202355460385439
"Suppose - for the sake of discussion - that something like alimony was agreed on in a pre-nuptual contract, and then funded with a bond.  Is that something that should be reversed or rendered invalid?

This is clearly an extreme example - and possibly a straw man - but, the headline CMV does go with ""... **any** forms of alimony...""",0.3849036402569593
">I call that suffering

Calling it suffering doesn't do much, unless it implies an action.  Would you murder a Pug with breathing problems?",0.4759100642398287
"I grailed JAlter, next one is Chloe",0.4534261241970021
"> I'm not sure how it is for others, but for me the Wiki isn't very phone friendly.

I'm curious, is this line regarding the default mobile layout for the wiki? (Which I think is downright horrible.)  

Or are you already requesting the desktop version of the wiki on your phone, and (justifiably) still find it unwieldy to navigate due to the frequent zooming and panning required?",0.3752676659528908
well at least there is an antivaxxer who understands that vaccines don't cause autism  ,0.4427194860813704
"r/unexpectedRT

Yeah I found this like yesterday.",0.21948608137044967
"They keep prisoners in jail just fine, don’t see why one wouldn’t be able to keep bad people out... ",0.43147751605995716
"They're saying ""Booo-lues""",0.27516059957173444
Thats what they WANT you to think.,0.19111349036402567
"Every school I toured when I started looking at colleges had either someone manning the door or required two separate anonymous swipe cards to access a room. I’m not sure if Utah has something similar, but if not, that’s a major security oversight on their part. ",0.3533190578158458
You said vaccination is a poor choice by accident.,0.4427194860813704
"Kernel?  Try screwing up the boot loader to really break things.  If it can load the kernel you're already 90% of the way there.

(If you mess up your initramfs, you're in for a whole new world of adventure.)",0.3977516059957173
it's extra frustrating on the weekends when I get to sleep in!! half the time I cant fall back asleep because I get hit with the anxiety of all the things I have to do and everything I procrastinate on... hahaahahahaa..ahahaa...............,0.25963597430406854
"Couldn't you though? As I've said above, I'm not a believer in cultural appropriation (as a POC) but I can kind of understand their point, I just don't think people should get so militant about it. 

For example, I do feel rather annoyed sometimes when people don't appreciate something to the same depth that I do. I would say it's a similar mentality to gatekeeping - but of course in reality there are the additional factors of social disadvantage/power imbalance/discrimination to be considered when talking about cultural appropriation as opposed to being a fan of a game or music group.",0.4989293361884368
My portfolio is up almost 25% since he took office!  Rolling back Obama regulations which hurt our economy is a huge help to every American.  Illegal immigration is way down while deportations are up.    I love the way he calls out the media on their bs.  He's done a lot of great things and obviously loves America.  I'm really glad I voted for him.,0.3977516059957173
Kids. Also I don't date girls my friends have had sex with.,0.55406852248394
"What was the lie? They detected a cyber attack and reported it to the FBI.  They didn't know where it came from because the group that was performing it never notified them.  They never said it was Russia, Microsoft found a Russian attempt on 3 campaigns earlier that was actually Russia.",0.3849036402569593
"When trying to use Mjolnir's power he's accidentally struck by a lighting ""ray"".",0.4089935760171306
"Sign me up, I’ve never been ok with the spiderbro-ing lobby",0.30888650963597425
"You specifically stated that:

> If it was unfixable and causing a lot of suffering to the animal

...How do you know either of these things will be the case before the animal is born?

What percentage chance of suffering is required for you, personally, to decide that the birth of something should be *actively* prevented? If you knew that 90% of Pugs were happy, would you make the same decision? 60%?

This is relevant because you have an opinion on the matter, yet you're not willing to adopt a practical belief (i.e. take action on it), it appears. I could be wrong.",0.43147751605995716
"I mean i like helping people there sometimes, but with actual problems, not this bullshit.   
  
And mobile version of wiki is not that bad imo, but thats me.  
  
Reddit is much worse on phone.",0.6654175588865096
"You can absolutely be too generous, that is flat wrong. ",0.38650963597430404
Don't like this guy. Unless you're a fan of his fighting I don't see how you can like him.,0.5428265524625268
"Just to be sure, when you say she's ""married"" to somebody else, you mean she's married to, say, her friend Tina that she hangs out with all the time, and not her Ex-Husband. Right?",0.44164882226980723
"There was some controversy around that vaccine for a while several years ago.  I know because my parents waited to get me vaccinated for that until I was about 16 or 18, I can't remember which.  I would assume (in the hopes of positive reasons) that's why your family might've been against that vaccine.",0.38650963597430404
I am having flashbacks of my daughter projectile-shitting all over me at Thanksgiving. Like a super soaker of liquid feces. I am still haunted by the sound of my own screaming. ,0.6274089935760172
I feel like my basic view was explained in the initial description? ,0.31959314775160597
Wait a minute! I still haven't gotten my pay check. What gives?,0.3752676659528908
"What happens if you can't prove fault, but it exists?",0.28640256959314775
Sometimes there is good censorship.,0.28211991434689504
"> fairly well documented adage that married men receive less frequent/exciting sex over the length of a marriage 

Source?

> the wife in question should be tasked with finding a suitable sexual replacement for her husband. 

Does she have to perform the finding or can she just allow it and let him do his thing?

Why can't the man be responsible for determining what he accepts in a relationship? If he isn't happy with the situation don't get married, or if already married get divorced.",0.5653104925053534
"Except that when you buy ivory, you have hired some one to do the killing for you. Just as bad as killing the elephant yourself.",0.4759100642398287
Parenting is obviously complicated and a balance between those two things – I can't give you exact numbers on it. All I'm saying is that spanking can be part of a balanced and healthy parenting style. ,0.3752676659528908
"ITT: People explaining how economics is supposed to work, not how it works",0.24143468950749467
"Sadly the alternative is that these firms just eliminate internships all together or reduce the number since they are required to be paid. 

Unpaid internships also are generally limited to saturated fields. Engineering interns can make $15-$30/hour at many companies because they are extremely in demand and create monetary value even as interns. 

You pay money to go to class to gain valuable experience. It requires time, money, and commitment. An internship only requires time. By your logic people should also be paid to be in school or at the gym. You're doing it to benefit yourself, if it costs time and money, that's on you. ",0.4646680942184154
"It's telling how the Trump lovers in this thread are choosing to attack Scarborough rather than defend Trump. I would say that it's because his behavior is indefensible, but these are Trump supporters we're talking about.",0.5203426124197001
Hentai immunises you to sexual relations.,0.45289079229122053
The solar panel companies will be so mad about this. When they miss-sell panels to old ladies they always say the panels will pay themselves off in a few years based on the payments you get from surplus energy. ,0.373661670235546
"Under what ill serving definition? Encouraging someone boycott businesses with bad practices is ""extremism""? Do you even know what the word means? An extremist would say to burn down their offices, or kill members of the company. I am simply saying don't do business with them. Do you even care what the words mean that you use or are you just attempting to vilify me so you don't have to do the work of actually thinking for yourself?",0.6541755888650963
I reckon a lot of rapes go unreported due to fear of retribution by other inmates?,0.5428265524625268
GET FULL CUSTODY AND THEN GET THE HELL OUT.,0.7548179871520343
Are there drugs that are commonly used to treat depression and anxiety that have similar potential for abuse?,0.36456102783725913
"Money. 

Money in politics is a bigger issue than partisan bickering. Honestly, I don’t care if someone views me a the enemy if I can still use evidence and reason to ensure the proper incentives for good structure. I definitely do care if me and my well meaning political opponents are both undermined by monetary incentives to the people with power  ",0.5203426124197001
"alright first we need to define what kind of god you are referring to, if its the omnipotent omniscient god type then there is a very simple reason why it does not exist. 

we are unable to properly verify omnipotence, thus we are not capable of acknowledging a being as being such. thus god does not exist",0.487152034261242
That first question was perfect.. the way he ends the question as if it's mid sentence,0.23072805139186298
"Fuck, I'm stupid. *Investing the $1.2M vs rental income*. Early morning.",0.7660599571734475
"Conservatives are always on THAT side of things. Here is a short list of things Conservatives have caught for or against in the past that are either gone or still available despite them. 

Anti revolution pro loyalty to Britain 
Pro slavery
Against the 40 hour work week
Against the 5 day work week
Pro child labor 
Against blacks having right to vote 
Against women’s right to vote 
Anti Civil rights movement 
Pro Vietnam war 
Against interracial marriages 
Pro segregation 
Pro separate but equal schools 
For the wars in Iraq / Afghanistan 
Against the healthcare act 
For the wall 


Feel free to add to this list. 

",0.5203426124197001
"Some spiders can walk on water like our Lord and Savior, and at one stage in their life (the very beginning, like from Charlotte's Web), they can fly. Many of them can burrow. The most awesome part about spiders though is that they can hide so well, they become *invisible.* Dragonflies are so erratic that they couldn't dream of the power of invisibility. ",0.4534261241970021
"Would it really matter if I shared that story about ""that one time I...""? Whose ever believed an online comment describing someone's amazingness?",0.4646680942184154
I'll be honest... I haven't even reached the let's go on a date phase... Netflix phase must be nice ,0.29764453961456105
"Sort of? I mean, we’re aware of the stuff that you’re saying. It really depends how they’re presenting. Depression and anxiety exist on a spectrum, so even if people’s symptoms aren’t consistent with a clinical diagnosis, they can still often benefit from therapy, and their treatment would be adjusted accordingly.",0.3533190578158458
"I did, but compared to the players that has already been listed in the 'top 20' category he certainly isn't #4. G2 has barely been relevant the last half of 2017. Yes, his numbers are impressive but that's with the minimum of maps they played in the group stage. If he barely scraped inside the top 10, then yes, I would agree. But ranked at #4? Come on.",0.36456102783725913
Poor Yumiko. Someone that fine shouldn’t have to kill themselves. ,0.6156316916488221
If you want to do something like asking a girl out or to prom etc don’t procrastinate or wait last minute before it’s too late,0.24143468950749467
There's a term for it: Crank Magnetism.,0.25963597430406854
This is why sustainable development and poverty alleviation are such effective tools in conservation biology. Promoting industries that provide fair and equitable livelihoods for impoverished communities can lead to major conservation outcomes via environmental protectionism and stewardship if the  harvest or exploitation is subsistent and reliant on a stable ecology. Over the past 40 years the conservation community has pivoted from a pure preservationist model to working within anthropogenic systems to achieve our goals.,0.4089935760171306
"No, we don’t have universal background checks.

Privates sales including at gun shows by private dealers are not required to have background checks. 

Only federally licensed dealers.

Are you going to stop lying now? 

It shows how lame the gun humper argument is. ",0.5985010706638114
">So assume I accuse my spouse of abuse. But I can't prove it. Do you force me to stay in a potentially abusive relationship? Or do you assume all accusations of abuse are true, thus giving an incentive for people to accuse their spouses of abuse? There's no third option.

Yes there is, the one I am proposing : you can leave if you want. You are not entitled to the product of the work of the other. You just leave, and take what's yours, but nothing of what will be the others.

How hard is it to understand that I still propose that you can divorce anytime you want for whatever reason you want,  BUT that you only get to keep extracting money from the other if you can prove a very good reason to force them to ?",0.6209850107066381
"I can live off of 1000$ per month, and i can live off of 10000$ per month. I'd rather not live off of 1000$ per month, so i acquired skills n such so that my time would be worth more.

6000$ per month can barely afford rent in the silicone valley area but can provide a lavish lifestyle in mid country.
Living wage is relative. And being able to support you and your family is not something to be taken for granted",0.29764453961456105
"Yup. Muh patriarchy. Totally not because of human trafficking, ""morality,"" or any of the other reasons mentioned. It's totally to keep womyn down. Except that men can be prostitutes too...",0.6097430406852248
Sometimes I really wanna be a doctor just to try and make a cure for autism or something to see how antivaxxers react,0.487152034261242
"Does anyone know if Trump had any involvement in this? Like did he or his government play any role in the negotiations? And if so, do you think he's gonna be considered for a Nobel peace prize like Obama was for his role in the middle east? ",0.4427194860813704
The most dangerous things about vaccines are the anti-vaxxers themselves!,0.487152034261242
"I did read what you wrote but it's a bit confusing. You said the gov won't be deciding what is and isn't real news but then say they will be punishing those who put out fake news lol do you not see the disconnect there? Obviously if they are punishing fake news organizations or disseminators they will of course have to decide what is and isn't fake to do so right?
",0.4646680942184154
The person who shoots. Jesus fuck.,0.8774089935760171
Politicians - always putting self interest first.,0.31638115631691643
"Kaczynski was valuable enough to put into jail at taxpayer's expense. That doesn't mean he's right, which is my point about whoever was fired in the first place.",0.5214132762312633
OP did us a favor,0.17505353319057812
I can't believe what Zach said about David Sedaris!!!,0.2778372591006424
"Listen I'd gladly pay more in taxes if it meant not having the slightest medical emergency possibly ruin my life financially speaking, or when I become older I won't have to skip taking pills because I can't afford them. 

Also my student loans make it so I might be able to leave my parents house when I'm 28. I'm 22 and it feels like I'm going to start my independent life when I'm almost 30 and that is incredibly depressing. I feel like I'm wasting my youth away because I have to work off student loans for a college I was forced to go to. I know Bernie Sanders wouldn't be able to solve my problems in only 4 years but damn I really want hope for change",0.4089935760171306
"> it's a touchy subject for me living in a social context that is still frequently anti-feminist and anti-men-doing-things-that-aren't-traditionally-masculine (there has to be a better word for that)

I mean, the word is “patriarchal,” but your wording is more specific and probably less likely to offend people on Reddit.",0.45235546038543895
They only plaster it because people want to see it.,0.3276231263383298
"march 14, the Little Dipper was missing... anyone... I'm not going to solve this and the crypto pyros are on it and I used my real email... terrified   ",0.3961456102783726
"Parents have a general legal duty to provide for the care and well-being of their minor children. While there may be some explicit positive duties listed in a state's Constitution, statutes, or common law, there is no exhaustive list.",0.31316916488222696
You'd do well in prison. most would a pack maybe two for 10 minutes some with you.,0.4759100642398287
"""And I brought you into a plentiful land to enjoy its fruits and its good things. But when you came in, you defiled my land and made my heritage an abomination."" Jeremiah 2:7

Also, ""Whoever is righteous has regard for the life of his beast, but the mercy of the wicked is cruel."" Proverbs 12:10",0.4534261241970021
"It's just starting to impact them and numbers are growing. 

Even a single snow flake is dangerous in an avalanche",0.3977516059957173
"Ok, crazy but she has a point.",0.3977516059957173
"Not really. California came at a point when it was clear Bernie had lost, so it's not surprising that Clinton won.",0.30888650963597425
"Not really. Since in Muslim flights they would kill mostly Muslims, it would help since these segregated flights help cool off the tensions between the religions and cultures. If a 100 Europeans die, Europeans would be angrier at Muslims than if a 100 Muslims die. 

Sometimes separations are the right thing. Chehzs and Slovaks are in a good relationship since Czechoslovakia got divided. 

",0.6097430406852248
">-Americans will become the number one killer of Americans.

They already are dumbass...",0.7548179871520343
I dont think it helps your argument to falsify the non-binary population; its something less than a single percent last I checked.,0.3961456102783726
"Politics is about money not happiness. They make you happy enough to get your vote so they keep making money. If they are getting votes and money, what reason is there for any changes to be made? ",0.3752676659528908
bull shit. Just like that journalist who was sniped for absolutely fuck all right? ,0.8329764453961456
"Go watch the last Peeker's advantage podcast episode, he explained himself pretty well.

It's a ranking of individual skill. When you play for the best team your stats are gonna be naturally inflated from just winning, even if you're like the 3rd or 4th best player on the team. And in his opinion Fallen didn't have nearly as much impact as he did in 2016.",0.31638115631691643
When Vegeta sacrificed himself and basically turned into stone in the Majin Buu story line after his speech for his son. Man tears came.,0.27516059957173444
Get the final upgrade of the prosthetic arts skill tree.,0.38650963597430404
