text,y
"Manafort was never supposed to be sentenced at all. He was supposed to flip. Digging up dirt on him was just part of the ""get Trump"" project. 

*How it's supposed to work*: Investigate anyone who might know something about Trump to see if there's anything he can be charged with. Threaten him with prison unless he gives up something that Trump can be charged with. 

*Why it doesn't work*: No one has anything on Trump to give up. 

*Why conservatives don't like this*: The whole idea behind criminal justice is that you investigate crimes to see who can be charged with them, not men to see what you can charge them with. 

*Why liberals do like this*: Orange man bad. 




",0.7376873661670236
So I was discharged from BCT with an ELS and Conduct(JGA). I tried to get a recode waiver through the NG initially but  NGB denied my waiver the first time. They said I needed a “Long Work History”. At the current moment I am employed through federal workstudy and I started at the beginning of the semester. I don’t have any prior work experience and I already have my letter of recommendations from work. Now should I wait and apply for an recode waiver through the NG in December or should I do it now? What do you guys feel?,0.33940042826552463
This is lowkey the most impressive thing to come from creative so far imo. I've never heard the song before that this is referencing but damn you made this sound amazing. I'd actually listen to this if it was on SoundCloud lol,0.3752676659528908
Awesome! This must have taken so much testing ,0.06852248394004289
"Judge needs to be removed from the case. As a person who has been abused, he has no right to comment on it. Even if they were instigating it, a 14 year old is barely capable of deciding what they want for dinner, let alone sexual consent. This is always on the adult.",0.55406852248394
fucking right? I played for 6 hours today and atleast 2 and a half of them were me getting back in after getting a ridiculous canary error. ,0.8174518201284797
The city that the stadium is in will earn way more money or time than the amount they put in it. Look at Cleveland and Lebron. It was estimated that the city lost 100s of millions with him being gone. There is a lot more money to be had for a city shen there is a sports team there. ,0.3752676659528908
Hell of a lot politer than the words I'd use to describe her...,0.642933618843683
Do your damn job and fill the prescription .... ,0.658458244111349
"Michigan, Clemson, or Washington will be outside the top 4 for either Louisville, Ohio State, or Texas A&M",0.22537473233404712
Gordon Keith has a calm dark sense of humor. He is a radio host during the day with The Ticket and does these type of interviews as a side gig. ,0.2639186295503212
"> The long game is looking good, we just need to stay alert and active, so we survive the short-term clusterfuckery.

Republicans have control of state legislatures, governor's mansions, the House, Senate, White House and Supreme Court. The long term is not looking good for Democrats. It may seem like we're at rock bottom but we don't know that. We could lose in 2018 and see quite a few Democratic Senators go without picking up too many House seats. If this happens we are in serious trouble. ",0.5203426124197001
"guys, some vaccines aren't necessary, like the chicken pox vaccine is stupid. And unless your have some condition or a weak immune system whats the point in getting a flu shot? Im thankful my mom actually reads whats in vaccines before we  get them.",0.5872591006423983
">i could choose from a bunch of words but i randomly picked soy boy for this instance. thats as deep as it goes when I call someone it.

But does it happen randomly? That's what I don't believe. 

If I use an insult it's because I assume that it hurts the other or that I think it's something bad.

When I hear ""soy boy"" I don't feel hurt, all I feel is that this person must think that an attack on someone's masculinity hurts others as much as it would hurt them. ",0.5353319057815845
🦀 my life is a lie 🦀,0.2526766595289079
"Don't fuck with Mother Nature too much, or else she'll have you eaten. ",0.7992505353319057
At risk of sounding like an ass.. fuck those specific pharmacists in particular!,0.8661670235546038
"Don't have to worry about being too big to fit on a roller coaster. Although rare (unless you're in the military), you're less likely to be much of a target as taller people will stand out and you can easily take cover.",0.5572805139186294
"Refreshing seeing Nova Scotia on the front page for a good thing, last time was when Pizza Corner dissolved (Less we forget.)",0.2526766595289079
Inability. Not even close to getting any sex. ,0.6097430406852248
"They are all about punishing women, end of story",0.5444325481798714
"The Pope should excommunicate him just as a """" fuck you too dude"". ",0.9298715203426124
The timing of the murder here is convenient for Russia.,0.487152034261242
">A lot of racism comes from 

Again, racism is merely based in race; not culture. 

Racism would be to assume all people of a certain race participate and accepts a culture or certain aspects of a culture that you disagree with or dislike. 

Or to only have an issue with people of a certain race that participate/accept the culture or aspect of that culture you disagree with. 

So how would not condemning culture appropriators change that mindset?

",0.5899357601713062
"That question is not very easy to answer either IMO. 
Does acting immoral include faking moral actions? Is there a difference between your point of an immorally acting person having the option to act morally and the option to fake acting morally? How do you tell the difference?
I think immorally acting people ALWAYS have the upper hand compared to people acting within any belief/moral guidelines, simply because if a moral action would benefit them, they would just fake that action.


",0.4089935760171306
No but a sugar tax would help.,0.31959314775160597
This makes sense. However I would not want it to happen because the queue at the women's toilet is way longer than the line at the men's one.,0.36456102783725913
How could anyone choose Hell over a loving God?,0.4427194860813704
"
- Most of you believe that anything that can further human population is good and/or moral, even when it Is detrimental to the rest of earth.

- There is a split among you about how we should treat animals. The line is blurry for most everyone in the thread.

- Weirdo dog breeding has made some really disturbing traits in dogs and cats. Animals suffer and live awful lives because ""cute"". I'm not an animal rights guy, but how this get a overlooked all the time is bizarre to me.

- This thread has delved into some great discussions and I've appreciated that.


",0.5091006423982869
"Fucking Peep Show, thanks for reminding me that I’m due for a rewatch.",0.7992505353319057
"I think it comes down to states and who's available. I know Wolf-Pac and Amend the fourth are both pretty big on local fronts; but are rarely in the news because they fight on convincing local representatives to support bills to get money out of politics. I know there are others; but it comes down to your state and what progressive organization you have in the area. Unfortunatley it comes down to personal research. However, with Our Revolution if they build the site up right to include all local progressive organizations things might be easier for people to hear about them. ",0.3977516059957173
"Could buy some pop tarts, too.",0.13436830835117772
I'm not a women's studies major but I know enough about the field to know that that's not an accurate characterization of most programs or the field of study in general. Do you think that pointing out instances of sex-based difference in our society and in the way we formulate knowledge is not a worthwhile activity? ,0.5315845824411135
"You cannot always tell someone’s health by their weight. I’ve struggled with eating disorders for 20 years - at my lowest weight I was being commended for how slim and “healthy” I looked - when I reality my hair was falling out and my heart was in very real danger. Through recovery I have gained over 3 stone and am now at a stable weight which hovers near obese - but I’m finally feeling healthy, my metabolism is steadily going back to normal, my digestion is correcting. And yet my family (who don’t know about my ED) are suddenly “worried for my health”. I don’t buy that we’re all constantly worried about the health of fat people or the impact on society - we just don’t like fat people - and most of that is based on stereotype assumptions and prejudice ",0.3977516059957173
[deleted],0.38650963597430404
"My dad is currently in the room next to me on hospice, morphine, oxygen, and very close to passing at this very moment. I don't know what I am going to do. I just wanted to let you know that you're not alone in this. And I believe it's completely normal to feel utterly lost like I also do, right now.",0.41755888650963596
True but the best hot chocolate is so for consistency let's discuss marshmallow versus whipped cream with milk hot chocolate.,0.14132762312633834
And how many of those are gang related?,0.3420770877944325
"Scented stuff...candles, potpourri, air fresheners, sprays.  They all stink and bother my allergies.  ",0.4759100642398287
"Posting this again for more input ;):

598s or 600s for gaming?

I spend about 70% of my time gaming and 30% of the time listening to music.

I would have the soundblaster omni as amp for the HD600, don't know if it will be enough.

I heard the 598 has a better soundstage, but the 600 would be clearer and betrer for music... For allround use, would you recommend the 600 or the 598 if money was not an issue?

I have the m50s and tried the X2s (maybe I got a bad one, they seem to have QC issues) and don't really like them for gaming. I want something less bass-y

",0.38650963597430404
Can you give us some examples of the food?,0.15256959314775162
"You do realize that rape isn't that common in prison right? Basically 99% of the time, the only men in prison having sex are men that want to be having sex.

The only people who expect others to be raped in prison are people who don't know what prison is like.",0.7039614561027837
Motorola is severely underrated. I have an S10 now but I still miss the phone gestures I could do with my Moto G5.,0.23072805139186298
"> Every date I have had on there has resulted in sex on the first date with most of them getting repeat dates

How pretty are you?",0.55406852248394
"Nope, they have made it very clear since the start that CSS will be gutted from the new design. They have stated that there might be some CSS options, but not real CSS like we have always had. I have been a mod, on multiple accounts for ten years now and I know a lot of long term mods. No one is happy about this.",0.36456102783725913
"Churches are the main ones who lobby for statute of limitations for sex offenses. Seriously, why should there be a deadline on charging your rapist or molestor?!?!? Oh, because a church spent money to help get that law passed.... ",0.7880085653104925
"Honestly, I think there is a way to categorize it. But I think psychology as a field just isn't there. I think part of the problem is that the top people in that field are extremely ambitious when it comes to categorizing people. But they lack the fundamental knowledge necessary, and are in a sense, ""jumping the gun"". ",0.4202355460385439
this has to be fake lmao ,0.487152034261242
Seems like GI should be investigated for having close financial ties to a mass murderer.,0.4646680942184154
Spongebob Squarepants the Movie Video Game,0.14989293361884368
"Imagine being Amish and being forced to go to a city and entering a place you believe to be absolutely evil. Then you watch someone you despise stab your child with a needle and inject pure evil inside of them. 

 And if you don't do that and your kids get sick, they will come with guns and arrest you and put you in a cage potentially for the rest of your life. Anyone who resists will be killed. ",0.6241970021413276
RIP . some one should tell him about his untimely demise ,0.6097430406852248
They are made to be worn. I got a pair of the Alien Bugstomper Hi-tops and the idea of putting them in a case makes me sad. One day they'll be fucked and unwearable but it is their destiny and i won't stand in the way.,0.6879014989293363
"Not very. I'm Chinese. My ex girlfriends are, in order, Chinese, Indian, and then White.

In fact, that pretty much reflects my attitude towards it over time. ",0.2708779443254818
"Hmm never heard of it, though I did grow up in a family that tried its best not to be German but rather ""modern"". ",0.37098501070663814
Where is the sort by porn button on this thread?,0.566916488222698
Which bidet did you go with asking for a friend,0.27516059957173444
Try living in Myanmar... Oh my god the internet..,0.3506423982869379
"Dude, there’s a reason they don’t occur...",0.24143468950749467
"All the Harry Potter books.

Mary, Bloody Mary by Carolyn Meyer",0.23072805139186298
Bioethics; an interesting field in which the wrong answer is always widely considered a bad move,0.40738758029978583
"In Islam it's a greater sin to kill fellow believers than ""infidels"".  By having segregated flights you would be providing terrorists with ideal targets. ",0.5428265524625268
"I believe it is given in the OP that this is 1:1. Your point is valid, but moot in the given parameters. ",0.27516059957173444
"Of course he would. He'd also end Obamacare, taking affordable healthcare away from nearly twenty million people. He'd also do his best to ban all abortions. He'd also bomb Iran. He'd also ... Oh hell just don't vote for the fucker alright? ",0.7323340471092076
las vegas was an illegal arms deal that went bad and was covered up by the govt to be a mass shooting. fact. and its a fact cus they have hidden much of what we know about this case. now get rid of what little info they did relaee and it will be even more of a fact.,0.5653104925053534
"I definitely do not agree with your assessment but I do grasp that it is the popularly held sentiment.

I stopped drinking dairy and everything with milk now nauseates me, so I know that isn't the norm. Haha",0.3420770877944325
Bike - 6:30 at gear 9! Beat my previous time by 30 seconds 😃,0.19111349036402567
"SOME roads have tolls. The vast majority don't. And hospitals are a bad example because they're such a complicated mess with where money goes, comes in from, pricing, etc. 

I haven't seen a single local public park in my area that charges money. The exception are some state parks and that's only for parking. ",0.36456102783725913
Scream BEANS N-word (I’m white) and the die in the most stupidest way possible,0.7323340471092076
"If the “profit is good” sentiment is true how would the media determine what to broadcast in the first place?

Also the Coca Cola analogy is flawed because you’re talking about a product that wasn’t in demand because it simply didn’t exist. If Coca Cola were to go out of business today do you genuinely believe there wouldn’t be a demand for it?",0.3533190578158458
"The scientific consensus, as you are aware, is that spanking is ineffective and will likely have negative unintended consequences. The onus would be 100% on you to prove that despite the scientific consensus, you are right and its fine or even good to hit children. 

Can you prove that it is ever appropriate, or even just ok, to hit children? If you can't do that, you probably shouldn't be experimenting with hitting your own kids. ",0.5653104925053534
I used to do $40/hr contracts at prisons. Now those contracts go straight to the trash. Prisons are incredibly dangerous even with my personal escorts. ,0.3752676659528908
"If you do not call from trump to meet the business end of a noose, you're a supporter as far as I'm concerned.",0.6209850107066381
[deleted],0.430406852248394
"Something about our ""Dutch traditions"" or football. ",0.3752676659528908
Is it scary or it is scary?,0.17505353319057812
"It's a legitimate question. In the 1970s it was considered ""abnormal"" to be gay and there were people who found it to be an imposition on them to say that gay people are normal as well and to consider it a legitimate possibility someone may have a same sex partner.

Your response is quite hostile, and you might be frustrated, but I really do not care whether or not you are a ""good person"". I simply am wondering if this is a particular position held regarding nonbinary people or a general position you have about accommodations made to minority groups in society.",0.642933618843683
"yeah prison rape definitley feels like something that's way more talked about in American culture/media as being a thing in prison. 

I'm sure many Americans won't believe me but it really isn't anywhere as much as a thing in British prisons as it is in American prisons, based on accounts from people who've been to prison in America and people who've been in British ones",0.5315845824411135
"Or, ""I have no filter"".",0.28640256959314775
"When I think of a place I want to proliferate nuclear technology, its the middle east. Literally cannot go tits up.

Edit: Thanks for the gold! Where can I exchange this for enriched uranium?",0.6541755888650963
"> I'm saying it hasn't been researched and yet that research has been used to categorically dismiss all spanking,

If it hasn't been researched, and therefore you have no evidence that ""reasonable spanking"" is effective, why would you even attempt it, knowing that you are still physically harming your child?",0.6241970021413276
"Absolutely true. Jew here. If you speak out against Israel, you will not be allowed to be president. If you're not running, then I guess we kill you?",0.6124197002141328
I have comically small hands and just making a joke of it is the best way to play it off and even make it into a positive I always say shit like “yeah small hands and small feet lucky for you everything else is perfectly average” ,0.5203426124197001
"It's not as widespread as the people making those comments would have you believe.  My mother and I had both worked at detention centers and at least in those, there wasn't prison rape going on.  If a dude wanted to fuck he let it be known.  Packs of gay guys weren't roaming around raping dudes like in Shawshank Redemption.  ",0.9218415417558886
Why am I not surprised that someone who knows how to dam rivers would be going to a shindig? lol,0.28640256959314775
"But by the same token that logic would apply to a God; how can a god seemingly come from nothing, thus by your own logic you have to ask what created him? A super God? Then what created that? A mega God? etc etc.

",0.6124197002141328
"autism^autism

Autism, to the autism'th power.",0.5214132762312633
Zombie fallout by Mark Tufo is about this very thing,0.38650963597430404
"Wouldn't kill the mood for me. 

""By the way, I'm not on birth control""


*Well I guess this means she definitely, really, clearly wants to fuck*",0.9400428265524625
"I do not think that is accurate. We have several (well, many) arguments FOR the existence of God. I have given six. 

I did not ask for proof, I asked for an argument. There is a distinct difference. We cannot prove the multiverse to be false but we can offer arguments for or against it.",0.4427194860813704
"I hope they all look like Zoro and have green hair, and in the end, there was a mixup and it turns out his real name is Vinsmoke Roronoa Zoro. ",0.373661670235546
"Short guys usually can't guy things off the rack, either. Clothes aren't made for short, thin men.",0.31638115631691643
Both at the same time,0.09689507494646683
Amazing dude! I salute to u! I don't feel like playing much honestly. ,0.20235546038543897
Quality content as always by thorin. ,0.17505353319057812
Maybe they should consider actually teaching kids about sex in schools.  Maybe informed people make better decisions about their health and sexuality?  Maybe Knowledge is power ???,0.5315845824411135
"Because knives are not illegal, as you just said in your comment. You simply need a valid reason.

Like 'im working', 'im fishing' what ever.",0.4534261241970021
I cashed in my retirement savings and bought a business in a field and market I know nothing about. Basically I had a consumer mentality I saw the price and profit history and thought of it like buying a product that I assumed would continue to produce the same profits. I also naively assumed I'm a smart guy I can easily run this business as well as the dummy currently running it. ,0.430406852248394
Hentai immunises you to sexual relations.,0.45289079229122053
"9/11

Upvote me or you're a terrorist.",0.6541755888650963
"Zionism is a real thing, but the idea that every Jew is Zionist is pretty fucking dumb.",0.8886509635974303
"Oh, now it’s not his stock market. He was lying between those two ears last month. If you like my stock market you can keep it!",0.3752676659528908
"Just so long as you're happy and she is happy, all is good. If that's the role you're filling, and everything is going well, then you shouldn't worry about it. Sure, it's not ""normal"" by society's traditional standards, but that doesn't really matter, tons of societal standards are meant to be challenged nowadays.",0.28640256959314775
At least in Minnesota you need a permit to purchase a handgun or a semi auto rifle. Shotguns and single action rifles can be purchased without one but you still have to pass a background check,0.43147751605995716
"Maybe it has something to do with the fact that Black/Mexican children and gay parents aren't increasing the chance that other kids will be exposed to a preventable disease, Karen....  I'll take a hard pass on making my kids suffer because of someone else's choices.",0.4646680942184154
Lot's of money to be made taking bullets out of school shooting victims I hear.,0.5653104925053534
"She is the daughter of Nicolas Madura and will destroy America, America needs a moderate, not trump racism or Venezuelan socialism of bernie",0.6991434689507494
We pulled out of the Paris accord which was redundant,0.3977516059957173
"It's bad from the perspective of a CURRENT Reddit user.  
But you aren't going away.  
It's good from the perspective of a Facebook user, which might transition to Reddit.  
  
You are not going away, the redesign is to get new users, so, ""bad from an end user perspective"" depends on which end users you are talking about.",0.3420770877944325
"yeah, those broke ass losers with the sense to find a phone that suits their needs and doesn’t require a goddamn mortgage to pay off",0.6970021413276231
"hey, they don't call it the devil's lettuce for nothin', you know.",0.33083511777301927
"Every second article on this sub is about Trump. /r/worldnews is just an outpost of /r/politics now.  

News about the rest of the world is forced to take a distant back seat. ",0.4759100642398287
"Funny for sure! But I've also read about how, even if Hitler didn't rise to power, the conditions were ripe for someone like him to do so. 

Imagine if someone like Hitler came to power, but actually had better military insight and didn't commit some of the mistakes Hitler did. Scary indeed.",0.4427194860813704
"Re reading what I wrote, I probably should have said ""essentially dissolved"". Libertarianism is about small, self governed enclaves centred around common belief and behaviour. ",0.24143468950749467
One underrated benefit: the new ability to cycle through posts using the ‘N’ key is very useful for erm... one-handed use.,0.38650963597430404
"Fuck that's sad. Fuck antivaxers!
I hope the respondant mother (of the child who passed away) finds peace.",0.9218415417558886
"Just stop. The classic attack on feminism is that they're just upset because they're unattractive. How about we stop ranking people by how ""fuckable"" they are?",0.7548179871520343
Don’t fuck a rope.,0.8549250535331905
That’s not hyperbole and scary.,0.3533190578158458
"The media and certain ""advocacy groups"" spent decades portraying autism as causing distant, cold children who can't love or be loved, can't interact with other people or have fulfilling lives, and will break their parent's hearts.  I wonder how many of these people still think that's true (not that it's an excuse, because it's obvious now that's untrue).",0.55406852248394
"I think you gotta wait until the playoffs are over to say that, last year his numbers were godly ",0.2639186295503212
He has the arms of a folding chair,0.3420770877944325
"> There's might still be moral people in such societies, but they usually end up with their heads on pikes to be shown off to their own daughters.

As long as most people are moral, this won't happen. If religious people were more likely to be moral, perhaps you would have a point. However, most religious people are moral and most atheist are moral, so this seems like a moot point. ",0.49839400428265523
"That next big emergency. I'm sure it's not only me, but I feel any time I start to collect enough money to feel safe, life finds a way to take it back.",0.2639186295503212
Yeah but you can be courteous without having to outwardly state it all the time so people know you're a good person. That's what I'm getting at. ,0.4202355460385439
Nervous laughter from a country that doesn’t vaccinate against chicken pox.,0.44164882226980723
Mostly the lack of quality poutine. ,0.2665952890792291
"Hopefully this is the beginning of a broader trend. 

I support personal freedoms, but not at the cost of putting the lives of innocent children or the greater public at risk. 

Science based medicine needs greater visibility and it is going to come from efforts like this.",0.4759100642398287
