text,y
"Tools are amazing to have. I've been slowly acquiring good tools over the past two years, and mainly get them during the holidays. Mother things I'm so grown to want tools.  ;)",0.30513918629550324
Give us back our elections,0.33083511777301927
Lack of Common Sense and Critical Thinking are the downfall of the USA.,0.5203426124197001
"When an animal struggles to breath and is prone to infection (you know, typically painful experiences) when an animal cannot do what it needs to do, like run and play, I call that suffering ",0.4202355460385439
"not follow my principles. It's really hard, given that there are loved ones who have come into contact with those; and I just can't give them up. At the end of the day when I'm 6ft under\-on a good day\-all I'll have left is the choices and person that I am/was. I'd rather have good morals and ethics which were equally applied and that I stood by as a man. ",0.40738758029978583
"I don’t think it matters if it’s more effective when she wears a hijab or not. It is her choice to wear one regardless of what you, or anyone else feels about it.",0.36456102783725913
The perceived risk is a pretty vital part of the story. ,0.17505353319057812
Finally I can get out my swastika flag and kill every jew again. And the earth is flat.,0.7323340471092076
Holy shit. Flamelurker and the gargoyles had bastard children.  Fuck yes.,0.9089935760171306
"probably conventional RPGs are not your cup of tea then?

have you tried other genres like Assassin's Creed or Mass effect or Skyrim which has RPG elements but not conventional RPG?",0.21948608137044967
Why risk it? What could beat being the most woefully entertaining President ever's mouthpiece to the world?,0.5107066381156317
"In Latin America I took a cab, those drivers drive like they got a gun pointed at them. Slam the gas pedal and just barley get by the 2 traffic lights in town",0.4646680942184154
I'm 39. My first job was at Burger King at age 16.  I worked there till I was 17. I have not eaten there since I was 17. ,0.30888650963597425
"This is most certainly true. But my reasoning is China might jump at this chance with whatever it can. But it is still only a might.

If the USA can turn itself around and get voters out there to actually vote, and start some major economic reforms in the next election. Then certainly it will keep it's status. 

But as it stands now the ball is in Chinas court, and it is taking advantage while it can. So for now it's definitely a wait and see, and the next presidential election will be critical",0.36456102783725913
"Whether it's a disability, loss of job, or poor spending habits, I'm terrified of not being able to provide for my wife and future family.",0.19700214132762311
Greenland has already shut its ports months in advance ,0.30888650963597425
"Wait, what was I supposed to tell you again?",0.17505353319057812
"How many citizens are collecting multiple pensions? Surely you can source that.

Aaand downvoted for calling out your BS. Typical snowflake.

Still waiting for citation ",0.6664882226980728
"I am one year over the active duty age limit. Is an age waiver difficult? 

If it is difficult to get an age waiver, would you say it is easier to go from ARNG to active, or from Reserve to active? 

Years ago I went ARNG to active and it was easy. But I'm not sure any more. I know they subtract the prior service active duty years, but I'm one over still. Thanks!",0.3276231263383298
And that is how to give yourself a home enema.,0.3977516059957173
"I think he's referring to the CIA's Disposition Matrix (the semi-automated list of people who are supposed to be droned if the opportunity presents itself.) 

From what we know (from leaks, etc) the Disposition Matrix is largely comprised of known members of foreign terrorist organizations. But the tricky thing is that some of said terrorists are U.S. citizens, and droning them is technically the U.S. government executing one of its own citizens without trial. 

Anwar al-Awlaki is probably the most well-known American killed this way. Multiple intelligence agencies believe he was the operational leader of Al Qaeda in the Arabian Peninsula, so you can kinda see why we did what we did, but... the guy was born in New Mexico, and thus as an American he had a constitutional right to due process which wasn't honored in his killing by drone strike.",0.55406852248394
"My dad gets mad when he has to use an app on his phone to change the channels on the TV after ""someone"" misplaces the remote. He says, and I quote, ""I shouldn't have do do this crap, get my phone out and open an app just to change channels. This is ridiculous!"" I tell him all the time ""Do you even hear what you're saying? You are using an app on a PHONE to change the channels on a TELEVISION! You need to shut up and just do it, cause that's freakin remarkable!"" I swear it's like we've switched roles and now I'm explaining to him how it used to be back in my day...smh, it's awful.",0.5224839400428265
"It is one way to financial success, though it depends wholly on the business.

Apple is incredibly successful though it is a fairly responsible corporation compared to its competitors. Oil companies are successful despite being terrible.




",0.30888650963597425
"You raise some interesting points, but I think they could raise doubts about the child getting infected elsewhere in public (grocery store, church, etc)",0.29764453961456105
More like fuck your dismal reading comprehension.,0.933083511777302
"""Flex""? It's a ""flex"" to acknowledge the blame is with corrupt capitalism in government, and that ""communists"" have absolutely nothing to do with it?",0.4427194860813704
"You've created a logical loop that can only be answered your way. 

Of course you'd be better off financially paying an employee 1 cent less. Participating in all activities than a select few would make you more money. I think another commenter made the point that you'd be able to participate in things longer if they were moral/legal than illegal. But ascribing moral behavior based on monetary gain eludes the other circumstances that lead to that choice being made.",0.4759100642398287
"""Eww! hell no"" \*laughing* was pretty bad.",0.5428265524625268
flame lurker or something. tehre was a fire boss there.,0.5101713062098501
"I think you're missing the point of this CMV. Look back at the title of the post. This is for discussion of whipped cream vs. marshmallows, nothing else. ",0.23661670235546037
"If pigs could fly, just imagine how good their wings would taste.",0.3420770877944325
"> I mean if you're getting them off tinder the expectation is there, isn't that what tinder is for anyway? to hook up? I'd expect sex then.

This, pretty much. If I'm going out with someone from Tinder - expect to get laid if things go well.

Anything else it just depends.",0.6504282655246253
"It’s like putin and Russia, yes they have a lot of billionaires because of him, yet the country is very poor. Yes Amazon offer high paid job, but it doesn’t counterbalance the amount of underpaid workers. People had to wear diapers so they didn’t have to go to the toilet. ",0.4534261241970021
"Do you think there are *some* beliefs where it's reasonable to assume someone is your enemy for taking them? Surely it's not right to vilify someone just because they prefer a different healthcare or education scheme or want the top marginal tax rate to be 10% different from what you'd prefer, but it seems just as unreasonable to expect, say, queer Americans to not view people actively trying to erode or prevent their rights as enemies. ",0.4759100642398287
"Oh man, I'm trying to get pregnant and know so many cops... I'm totally going to steal this lol",0.5342612419700213
"No. Be like “yeah I’m down for that obviously”. 

If she freaks out and set up a trap, she’s fucked and just gave you a reason to move on.",0.7376873661670236
So good to see most of the Suns trying until the end.,0.24143468950749467
I was unaware that Jesus advocated for the takeover of distribution and means of production.,0.4641327623126338
"haha, yeah, that's the male sex drive for you. Guys usually think that when a girl is smiling or looking at them is because she wants to smash. It's worse when the guys are in their early 20s.  Which kinda makes a lot of friendships uncomfortable for a lot of girls because sooner or later, there's a lot of guy friends that are gonna try to smash, especially if the dude's been having a dry spell.",0.55406852248394
The sweetest deal being that we get charged billions a year while other countries protect their inefficient industries by blocking trade deals with our historic allies?,0.3977516059957173
"Anyone who has even reportedly touched a level of confidentiality in relation to  abuse/rape (ie mandated reporters from universities, actual councilors, etc.) will tell you that the most important thing for someone who has made the first step in reporting abuse is to let them maintain control. If they dont want knowledge of their abuse splayed on the table divorce for whatever reason that is their business, not yours or the judge's or whoever.",0.3977516059957173
fuck who you want to as long as they can consent.  ,0.8442184154175588
"Wow, this blew up. Make sure to *VACCINATE YOUR FUCKING CHILDREN*",0.8832976445396145
What about animal models for human disease research?,0.41755888650963596
Compassionate conservatism has morphed into cruel conservatism. ,0.5428265524625268
"Gaunt's Ghosts -series of Warhammer 40k -lore. Band of brothers meets starship troopers. Wonderful drama, action and humor. ",0.24143468950749467
I'm already white so it would be normal if I did this. Ez 20 mil.,0.3977516059957173
I think that guy in the end will fall in love with Nami. lol,0.22002141327623126
When does Israel get labeled a terrorist state?,0.5872591006423983
">It's very easy to obtain contraception and it had been for years.

If you have a parent that isn't a moron. I had to drag a friend to planned parenthood to get on the pill because her mother said and I quote ""I am not paying for you to have sex"" and hence wouldn't let her use her health insurance. This was after her dumbass sister had already gotten knocked up at 19. 

Birth control is very easy to get if you have money, control over your medical decisions and a car. Which group often is missing those items? And makes stunningly shitty heat of the moment decisions? ",0.6900428265524625
"It depends on who you ask and what you care about. If you ask someone like my brother, who really just wants to show off at the gym and lift more weight than anyone no matter what, disregard form.

If you ask someone like me, who lifts to be healthy, lose weight, and strengthen their body, form is everything. The difference is that the first group of people tend to get hurt a lot and develop long term problems- but hey, its all worth it so you could lift 4 pounds more than me.",0.45289079229122053
[deleted],0.3276231263383298
"Because it's not true..
This is the first time I hear this and I'm just as confused as you are.
Edit: I'm danish.",0.41755888650963596
I watched the testimony and it was very powerful. I imagine there are plenty of anti-vaxx parents who didn't enjoy it though.,0.4202355460385439
"Because, believe it or not, r/sneakers isn't representative of everyone who wears sneakers. Even if 80% of the users here had Breds/Frags (which is far from the truth) when they were talking about Jordans, that wouldn't imply that all Jordans are of the same quality.",0.36456102783725913
It has always been this way. With the advent of the internet and outlets like YouTube there is no excuse for not understanding a candidates position on issues. It’s good to see more people are realizing this and calling it out.,0.4089935760171306
"In London we have a street flanked each side by various jewelers. There are guys who hang around outside on the pavement waiting for the draft to blow tiny shavings of gold and such out of the shop doors so they can pick it off the cobbles.

I have no idea how much they make, but there seems to be a certain level of organisation to it. I pass this place (Leather Lane) most days and you always have the same guys working the same patch. I never even knew what they were doing there until I asked on of them.",0.3533190578158458
Logistics aside whipped cream simply has a better taste and is more appealing to the senses,0.14132762312633834
This guy is giving me fucking aids,0.8998929336188437
Perhaps its a insecurity thing for you? ,0.30888650963597425
"Great memo by Sundar. The engineer does makes points which are well worth debating. However, he crosses the line numerous times when he uses biology to explain why women are inferior as engineers and leadership positions.

Also, did anyone read that part about conservatives being more fit for 'mature companies'? Whatever that means. Sigh.",0.6322269807280514
Awesome. you made it to the top 10 of the day on all!,0.11884368308351176
That guy in the middle is cute AF! Normative and sexy,0.31959314775160597
I'm extremely disappointed with how big this thread is.,0.24143468950749467
He’s based out of Dallas - he has some of the best impersonations.  Local gem.,0.17505353319057812
"The US tax money they get isn't charity. They are getting it in exchange for Israel's innovation and intelligence. Also, it's such a miniscule amount that it isn't even felt",0.4202355460385439
I declared bankruptcy recently. Outloud. Nothing happened. ,0.20235546038543897
"Fuck yea dude

I'm down with the fucking swirl.",0.8217344753747322
What if the bomb instead blows up on the Vinsmokes?,0.4427194860813704
"No, it can do it. My father got stung by a few and developed an allergy reaction significant enough that we have to drive him to an emergency clinic which was, like, half an hour away. Pretty intense, but yes, it can happen. ",0.29764453961456105
"Not once did I even type that God punishes the unbelievers.

Did you get that?",0.4646680942184154
"Neither of you make a valid point- planes are not accessible to near enough everyone in your country, obesity is a completely separate issue that can in no way be realistically compared to mass shootings. This only happens in America, why can’t you see that?",0.4759100642398287
"Then here’s what you’re missing:  the type of men who are more likely to want an open relationship are less likely to be married, and less likely to stay married, especially to women who don’t “allow” it.

The type of wives that would allow it, therefore, are not wives, but rather girlfriends. The type of wives that **don’t** allow it are wives *because* they don’t allow it.

In other words:

If the wives *wanted* to allow it, why did they get married in the first place?

The type of people who get married are the type of people who won’t allow an open relationship, generally.",0.5326552462526766
Did ya blow ye O ring mate?,0.5315845824411135
"My brother ""only""  getting $X amount instead of $X amount for a video game trade in. ",0.24143468950749467
"I did not hit her, it's not true! It's bullshit! I did not hit her! I did not! Oh hi, Mark.",0.6991434689507494
"He's talking about people who don't have these CLINICAL diagnosises. At least that is what I interpreted.

There is a huge difference between a person who has debilitating depression and some lazy 22yo who doesn't want to get a job because they're ""depressed"" yet beg mom and dad for money to party every weekend.

Huge difference.",0.5203426124197001
That's just not even true. And if you really want to get political just remember that the current Republican *president* is fucking antivax.,0.8292291220556745
I just use Cuck like it's another shitty 4chan gag like normie and kek,0.5872591006423983
Already do. Still waiting for my discount.,0.33083511777301927
Those threads are awesome.  People hug and cry together.  That's where I learned about the Swedish flag.  Hilarious.  I also love the Weekly Rant.,0.2526766595289079
"This is honestly surprising coming from him, but it still shows any lack of expertise and acknowledgement to the complexities of the region by starting on a ""clean slate"".",0.49839400428265523
Im so sorry hope he get better,0.07441113490364026
"Yes, condoms aren't indestructible",0.38650963597430404
"If it was unfixable and causing a lot of suffering to the animal, I would in fact find it more merciful to euthanize it. But I'm not speaking for everyone here so eh.",0.29764453961456105
"Could you not love a ""purrfectly"" healthy moggy? One whose life you could save from a shelter and won't break the bank.",0.3420770877944325
"Just compare it to a kid dying of starvation. Basically, depriving a kid of vaccines that's been scientifically tested and proven to work through years of trials, is the same as potentially killing him.

Another option is only letting people above a certain intelligence level be allowed to reproduce. Then this wouldn't be much of an issue. Along with ALOT of other things... ",0.6124197002141328
"Yeah, he is a great golf player.  He's also a fantastic president!",0.14132762312633834
">Compassionate conservatism ~~has morphed into cruel conservatism~~ *was always a lie*. 

",0.49839400428265523
"""I can't stop myself from imagining that person as a ...""    
    
I mean, the easiest hole in that argument is you are saying ""because I can't stop myself from...."" that you assume what you can't help must be true?    
    
That isn't much of an argument.    
    
I can't stop myself from imagining that person as a ... tomato.",0.49839400428265523
I am pretty sure that genetically engineer people will not be selected for strength. Intelligence would be highly sought but not sure what that would look like. Think of it. I am certain that secondary sexual characteristics would not be a concern. Actually there is a current historian that  speculates that we may become a genderless species.,0.43147751605995716
"> What on earth does ""reaonable grounds"" even mean?

It means if they are being attacked they should defend themselves.

> I then point out that Israel defending its border has nothing to do with the right to peacefully assemble. 

Which I agreed to.

> Palestinians have no right to peacefully assemble in Israel without Israels consent. 

Exactly, which is why I suggested that Israel ensures their right to peacefully assemble (i.e. peaceful protest) in Israel. If they do this they can also provide security to limit any instances of violence.",0.55406852248394
"Yeah its kinda hard to pull older 5* right now, thats why im not quitting even for a day. When i skip one day its the end for me.",0.4534261241970021
We all know she'll try to *talk to the manager* while down in hell.,0.6038543897216274
"Ok, I'm as curious as hell, how do you make a ""tampon bomb""?",0.6579229122055674
"I'm surprised no one brought up the toilet fiasco. 

>*When first created, the Chamber was accessed through a concealed trapdoor and a series of magical tunnels. However, when Hogwarts’ plumbing became more elaborate in the eighteenth century (this was a rare instance of wizards copying Muggles, because hitherto they simply relieved themselves wherever they stood, and vanished the evidence), the entrance to the Chamber was threatened, being located on the site of a proposed bathroom.*  
>  
>\- Chamber of Secrets

So.... until the 18th century, wizards just shat themselves where they stood, and magicked it away. 

This is canon. 

Can you imagine that happening? A guy standing beside you, just letting out a sputtering explosion of shit and piss, and then flicking his wand and poof! It's gone. 

But you know. You heard it. 

*you know what was done*. ",0.6766595289079229
Can you restate that. I think you are saying the opposite of what you intended.,0.4534261241970021
"Luckily I wasnt that heavily invested in Reddit before the redesign, but I do agree; for being a ""better"" design it somehow pulled of being a worse design, not just visually but the functions and features aswell.

Say I wanna copy a text, nope that closes that persons comment. Say I want to read the entire thread I was replying to/reading, nope that opens up ALL comments on that post. Say I want to use different text formating - I have to google what does what, unless I know it by heart, and theres no way to look it up or change it on the fly.

Maybe Im wrong, maybe Im right, Im relatively new to the entirety of Reddit.",0.4427194860813704
Damn I didn’t realize you could mikiri that charging attack in the last phase.  Still managed to take him down but that would’ve been good to know,0.4759100642398287
and at every other point prior to this ,0.29764453961456105
I never understand this shit.. you know how you don't make more money? By not fighting. Iaquinta has been hurt for like 2 years and doesn't appeal at all to a casual audience. By not fighting all you're doing is extending the amount of time you won't get paid for. ,0.7880085653104925
Sure he did.  Trump new there would be abuse. He planned it. He wanted it. He encouraged it. He gave bonuses to abusers. Tell us why. What was his motivation in setting up kids to be abused and raped. What is the upside for him?,0.5653104925053534
"I dunno, porn would solve the problem of having everyone have to fuck each other all the time to get off, leading to less unwanted children.",0.9105995717344754
"I'm probably late, but I'm uninterested when she is uninterested. I don't like the feeling that I have to be someone else, or I have to jump around her to get attention and curiousity.",0.3533190578158458
If you defend mass murder I hope you find the psychological help you need.,0.44164882226980723
"Allow me to revise my statement:

The left plays a larger role in shaping the language allowed and disallowed in our society. ",0.31959314775160597
"Don't shoot me for this Reddit, but, anything that has to do with declaring herself a Feminist...it's rare for me to find a human that doesn't believe in equal rights this day in age, but women who feel the need to tell you they are a feminist...let's just say i see no benefit from further relations. ",0.5872591006423983
I wonder if lack of affordable healthcare has led to some of the issues we're seeing now.,0.33940042826552463
">How is this airline not painting a bright red bullseye on their planes? 

Just like banning guns or explosives was not a bullseye to provoke. 

",0.6209850107066381
">As an American I want **the state of Russia** to be punished for its actions as of late.

First you say that it is not Russian people generally, but the **State of Russia** that you think should be ""punished."" 

Quickly you changed your position to say that you are okay if the ""average Russian suffers"" even though you blame ""one man."" 

>I understand most people around the world are only into their personal lives and ignores what goes on around them. This mentality is wrong in my opinion as it leads to states ignoring the will of the people. 

Do you view yourself as some kind of informed observer? You seem to be war mongering. Notice how quick you were to carelessly pronounce harm to millions of people. *This mentality that you've suggested as an alternative is wrong too.*

 


",0.6921841541755888
"Your predicted ""epidemic"" is highly unrealistic. Regardless of whether it is legal or not, most people do not want to engage in incest, and most of those that do want to avoid having babies with each other for exactly this reason.

There are plenty of places where adult incest is legal that are not experiencing any such epidemic.",0.5556745182012848
"That's a common misconception, there was never a case in history of a donor getting sued. Plus if that were to happen they would be protected by the Food Donation Act ",0.3420770877944325
I reckon a lot of rapes go unreported due to fear of retribution by other inmates?,0.5428265524625268
"So everyone gets a sword?  Sounds like ""The Purge""",0.4427194860813704
So im confused about the name of the sub and this post. Is it making fun of antivaxxers or making fun of pro vacinators?,0.49839400428265523
Taxes. Free pills are cheaper than welfare for the unwanted children of single mothers/ couples who can't support kids.,0.5203426124197001
"Jesus Christ you people live a sad life eh?

At least I'm happy enough to just imagine how I would torture and kill random bystanders on the street—especially those with short hair.",0.6654175588865096
Mee Audio AirFi Matrix 2 or Ausdom M05.,0.19700214132762311
"Did you date my ex? Last words she spoke to me were ""WHY WONT YOU FUUUUUCK MEEEE!""",0.7992505353319057
"Makes me sad. They have an awesome culture aside from their political garbage. Same with the United States, too tbh. ",0.4202355460385439
I'm fine with The Hobbit in my ass. He is small,0.7103854389721627
At that stage you've still got ages to get ready.,0.373661670235546
Soggy Dollar Bar in BVI's!,0.31959314775160597
Google invited this discussion by setting up an internal forum for discussing their diversity policies. ,0.3977516059957173
"They're talking about this right now on The MMA Hour. Iaquinta's laying it all out. You can tell he's broken about it. I feel bad about the whole situation. Bummer.

Actually no, not a bummer. Fuck the UFC!",0.8661670235546038
"As a woman with big hands.... Tried that as a late teen to be cute, wasn't cute when his hands were smaller than mine :/ ",0.30888650963597425
Did his memo state that he's a rightist? That wasn't clear from the portions I skimmed.,0.3977516059957173
"Evil? No, you’re not evil. The absolute worst thing anyone could say about you is that you’re a selfish, moral blank whose lazy cynicism and sneering, ironic take on the world encapsulates everything wrong with a generation.",0.7992505353319057
