text,y
"Shady tricks = just dosent pay 

= tax evasion ",0.4646680942184154
"Well im not downvoting anyone on sight, just people being very very wrong (like Akstar >Esther), but phases for me were always connected to major gumi fuck ups, but now nothing is wrong (well few small things maybe but nothing major). Thats why im posting this. Something has changed...",0.6322269807280514
"""What's his problem?""

""His dad died in a mine field.""",0.4646680942184154
[deleted],0.7494646680942183
"Yeah. Minors cannot agree to sex acts or be involved in a legally binding contract. This is soliction of a minor, rape, and probably a few other charges. ",0.5315845824411135
i know a lot of good ones but they're all porn,0.6622055674518201
"I'm in my late 30's and have strong urges to have sex 2-3 times per week. Hell, give me an exciting 15 minutes at least a week! And I would rather not orgasm in favor of a longer session. I'm not fixated upon orgasm to be satisfied. In fact, I would rather go longer and please my wife/partner than ejaculate simply for the sake of doing so. It doesn't always happen that way, but it is the goal.",0.6156316916488221
"Its really a ""damned if you do, damned if you don't"" scenario innit.",0.44164882226980723
"This may be true. But not for the reason you think.

Peoples are upset because, for one, they feel as though it disrespects veterans. So kneeling to bring attention to their plight would be viewed differently for that reason.",0.6209850107066381
"I was going to say.

I always assumed world politics was more meant tonfocus on other countries.

It seems like basically every post I see here is ""Bernie this Bernie that"".",0.5765524625267665
Don't they know autism is autistic?!,0.4427194860813704
"Well, I teach Dave Ramsey classes so...  
  
1-paying off ALL my debt. $20,00 paid off so far, another $37,000 to go  
2- 6 months living expenses in my savings account  
3- down payment for a house  
  
Shorter term little things: I really want to get my son a dog for his birthday in August. He'll be 7 and I think that's the right age.",0.31959314775160597
But you keep a $1.2M asset.,0.22537473233404712
im not a fan of beautyism but she is ghoulish,0.45289079229122053
"I voted for Trump, I think words like ""white nationalism"" and ""white supremacy"" and ""racist"" and ""nazi"" get trotted out way to much as a cheap rhetorical ploy.  I've seen the tapes and I don't think that Donald Trump has ever admitted on camera to hating muslims or latinos.  I saw this headline and assumed it was more liberal bullshit. 

But no, that's fucking white nationalism.  That's unabashed white nationalism, racism, white supremacy.  Laura Ingraham is a racist.  I can't believe that aired on television, I'm horrified.  ",0.7548179871520343
"That's why you get to know them first and say ""No"" when you feel like it is not the right one. You don't get jump into one, you know.",0.33083511777301927
Upvoted for the awesome reference :) ,0.19700214132762311
Beautiful. Just beautiful. His sincerity is apparent both from the writing style and lack of spelling errors.,0.18576017130620984
Paranoiac Intervals/Body Dysmorphia - of Montreal,0.30888650963597425
"I have no plans to ever study it but what the fuck do you know about women's studies that isn't just MRA/TiA/KiA copypasta? 

See:

DAE feel empowered by their extreme ignorance on the topics they love to talk shit about?",0.8217344753747322
"Love these things; I barely buy toilet paper anymore

But mine does a wide fan not a fire hose blast 😧 ouch",0.3977516059957173
"A lot of difference... an animal that is never born need not suffer. An animal that is suffering is not natural. Take a pug, a dog that can barely breath and has bulging eyes wouldn't survive in the wild.",0.49839400428265523
I grail Kintoki and now I wait to max my tamano before grail her,0.43147751605995716
Could you pm me the link?,0.11884368308351176
"Racial profiling??? Really come on. You know if father was from Kenya and hes spent part of of his childhood in foreign countries.   So that's why it was questioned. Also, I never said I agree with the whole question of his berth place. It's just as pointless as bitching about his tax returns. 

Oh so now we will hold trump to a certain standard but doubt you will hold yourself or others to than same standard. 

What if nothing is wrong with his tax returns? What do you do then? Please tell me. 
It seems to me like your mind is already made up on the issue and you just want to find something to bash on him for ir getting him impeached. Just like the birth certificate, you are exactly the same. 

",0.6241970021413276
They vote directly using proportional representation. That allows smaller parties to exist.,0.28640256959314775
But vaccines cause autism Grandpa 😵,0.5428265524625268
"The flu vaccine uses small amounts of egg proteins, for adults this isn't a problem because there is an eggfree option approved for those over the age of 18. For children they simply cannot get that specific vaccine if they have a serious egg allergy. The MMR vaccine also uses eggs, but is ""generally"" safe because the eggs are used to ""produce"" the vaccine",0.3752676659528908
"Does anyone have any proof that vaccines do not cause autism that is, hear me out, sourced from Poland or Russia?

I need it for some ""goalposts were moved"" reasons...",0.5091006423982869
"Thorin and his controversial opinions, name a more iconic duo than this.",0.3977516059957173
"Well what is weird is subjective. Everyone has a different definition of what is normal and what is weird. As long as she is happy and you truly are happy, then what else matters? Your own happiness is absolutely much more of a priority than what other people think. When we find partners, we are finding a match - which means you both take on a role in each other’s lives that the both of you embrace.",0.30888650963597425
"> then use it as a platform for reward 

What do you mean by this? I see people who want to be *tolerated*, i.e. ""left alone"", but I can't think of any fat people who are actively seeking rewards for becoming fat.",0.6124197002141328
Does it actually cost the NFL money though? I'm legitimately asking. I haven't seen any analytics that can attribute a loss of revenue to kneeling.,0.27516059957173444
"I really don’t see much of the Republican platform representing libertarian values. Gun rights for sure, probably some tax reform too, but other than that the Republican platform currently is more authoritarian than libertarian (not to say that the dem platform is any less authoritarian, though) ",0.5556745182012848
"Maybe he'll start a project to build bipedal nuclear equipped tanks, and call them Metal Gears.",0.28640256959314775
I 100 percent agree. If someone has zero morals they can 'play capitalism' much better. But just because you don't have morals doesn't mean you always do the wrong thing. IE an unethical person can choose to be environmental purely because they know it will be good for the business's image. An unethical person can pay people a decent wage because they know those people are more likely to stick around. It's all about the bottom line and not doing the right thing.,0.4427194860813704
"I first read that as power Washington porn, and thought, wow what a weird fetish.",0.5224839400428265
Laugh at everyone freaking out.,0.4427194860813704
"Absolutely not. My brother works at a pharmacy that only deals with diabetes medications. They don't even stock anything else. If you come in with a prescription for anything else, their response is simply ""sorry, we don't keep that in stock"". 

The only restriction is that a pharmacist may not keep / destroy your prescription. ",0.3977516059957173
Except reducing teen pregnancies isn't exactly their goal.,0.40738758029978583
"This isnt true for all prisons though. It's only in Male prisons. Whenever a woman goes to prison the first thing people think about is the family they're leaving behind and feel sympathy. ""Society has no sympathy for the Male who can no longer provide a service. Only women, children and pets are given unconditional love in western society"".  - Chris Rock ",0.4989293361884368
Wasn't too bad. Got old lady pity and the number of one of the girls that worked there. I never used it - wasn't ready but I got some action from the story as a whole. ,0.4534261241970021
"It would almost be a relief if all they were after is money, because then they might actually make some responsible choices by accident.",0.28211991434689504
[deleted],0.45289079229122053
The judicial system's handling of sex crime continues to amaze me... ,0.5653104925053534
My portfolio is up almost 25% since he took office!  Rolling back Obama regulations which hurt our economy is a huge help to every American.  Illegal immigration is way down while deportations are up.    I love the way he calls out the media on their bs.  He's done a lot of great things and obviously loves America.  I'm really glad I voted for him.,0.3977516059957173
[deleted],0.3752676659528908
"I would like immigration made easier and a path to citizenship based on how long you have been here undocumented.

I want universal background check (no, we don’t have them now), mental health flags, increased waiting periods for long guns especially for novices. I would a national database of gun violence. ",0.49839400428265523
" I do and I don't see it as a character flaw or dating dealbreaker. If I were dating one, I would require respectful, reciprocal, informed non monogamy. Even if I never use it, the lack of a double standard would ease jealousies and tensions. I have known a number in my time and generally they're pretty normal people, just have a different line of work.",0.27516059957173444
"Don’t forget, Hillary sold 20% of our Uranium to Russia. This is all very scary. ",0.5315845824411135
Kill Cardi B's parents. Worth it,0.7210920770877943
"Fun fact, if you re-fast travel to the same spot it'll sometimes queue you into a new lobby with people!",0.17505353319057812
I can’t wait until I can call ICE on Barbara down the street for propagating diseases to be quite honest. Which island should we use?,0.4989293361884368
"I mean, the recipe does specify *medium size,* clearly the author wanted to accommodate the people with smaller ovens. ",0.19057815845824416
Can't not read it in his voice. Trying so hard but I can't,0.25481798715203424
"🎵And we 'bout it every day, every day, every day 🎵

",0.19646680942184153
Reading this makes me up extremely fucking mad. Like holy fuck.,0.9218415417558886
"Well not completely imo, my parents had legitimate concerns on what was a relatively still new-ish drug.  They were trying to be responsible parents by waiting until they were sure that the drug was safe.  I was just trying to cast a positive light on the reason based on my own experience.  None of us really know the parents reasoning except the OP's parents and possibly OP.",0.3752676659528908
Not talking about vaccines I’m talking about all the things regarding organ harvesting and drug problems,0.4089935760171306
I've only ever watched a few MP sketches and clips. Which movie should I watch first?,0.2526766595289079
I do presuppose the human right of self ownership. All my so called opinions are logical extensions of self ownership.,0.3752676659528908
I guess that means downvotes bring an STD-like burning sensation then? Let me just figure out the reddit usernames of my enemies...,0.5765524625267665
"Explain how you find it hot when your girl calls you brother, King Slayer.",0.4646680942184154
"Eh just vaccinate the child, the mom won’t be able to complain for long as she will be dead soon",0.5872591006423983
"Though I wholeheartedly agree with you, my view on this (albeit incredibly simplified) is that due to capitalism, if you city wants a pro team to move in because it will increase revenues and tourism, then you will offer to the organization's owner to pay for a portion of the arena.  In the end, the highest bidder gets the team.  I know its likely more complex than this but it boils down to capitalism, and that's kinda where I stop caring.",0.430406852248394
"I've spent a lot of time thinking about the idea of ""greenwashing"", so much that I've got a useless MBA degree in sustainable business. 

I think you should be more forgiving to companies who do ""plaster"" this information out there. It's a marketable value that would presumably create more demand and increase revenue...which then encourages more reinvestment into cause-driven efforts. 

Yeah, ideally, we would want the donation to come from a sincere place, but in the end, what difference does it make if a charity receives $1,000,000 from an anonymous donor or if they receive $1,000,000 from someone who hopes to share that information? Why not go for the win-win option? ",0.3945396145610278
It will be finding out all the things they bought and account for breaking their TOS by inciting violence and bullying.,0.4427194860813704
"If you don't immediately need the money, my philosophy is to never sell property. You talk about using the money for investments. Renting out a condo in Toronto is a heck of an investment. You want to travel, imagine the traveling you could do with a passive income of $2000-3000/month. Plus, you keep the value of the condo. 

Understandably you don't care to own property. But run the numbers. This is a real opportunity. Good luck with your decision.",0.30513918629550324
I think every 6 string song on all of periphery’s discography is in drop c and they are all challenging,0.33940042826552463
"You are dumb.  You didn't brick a 'linux system'.

",0.8442184154175588
And you don't have to be a total dickbag to other people to be funny.,0.7435760171306209
He’s far from awesome by any measure.,0.3506423982869379
I read that the country is buying up store front prostitution businesses and converting them to restaurants and such because gangs have moved in to control the industry. ,0.43147751605995716
"Yes, but the government is specifically supposed to stay out religious matters. Actively subsidizing religion violates the principles of separation of church an state.",0.45289079229122053
"Hans to level 70

George to level 80

OCu to 80

Berserkerlot to 90

I think I have two grails left atm, so I'm just holding on to them for the moment until someone else comes to mind.",0.30888650963597425
"Same! Except double that much. 

I just bought the house. ",0.2082441113490364
"I hate spiders, but I hate mosquitos, wasps and moths a lot more. I now have a spiderbro outside on my apartment balcony. It’s an orbweaver. So far (s)he’s caught a few moths and mosquitos and one wasp. I fucking hate wasps so I was really thrilled to see my bro being a bro. Sometimes I have to relocate my bro because its orbs get in the way and sometimes I do it to protect him from one of my roommates which hates spiders (yeah I know ʕ ͡° ʖ̯ ͡°ʔ). Initially my spiderbro was afraid of me, but nowadays we hang out together. Out of all of my roommates (s)he is for sure the chillest of the bunch and I feel that chillfactor should be a metric which should be taken into account when it comes to beneficial insectbro’s. ",0.5985010706638114
Raised Catholic here. According to the Catholic Church birth control is a sin because there is no reason to have sex other than to procreate. It also imposes as “emotional” (?) barrier between the spouses.,0.49839400428265523
Wait you guys have ever gotten paid?,0.29764453961456105
"This was my point, rape is one of the most violent crimes you can commit. People Comparing it to sexual harassment (which is still terrible) are clearly trying to make it seem less than that ",0.5808351177730192
"Well classic answer 1 would be: men are always better anything else is a rare exception
2 they're getting hired only coz they're sex objects and obviously no one ever would see them as otherwise
3 you can always find a man just as qualified",0.5985010706638114
I couldn't restrain him for more than a few seconds. ,0.4534261241970021
">Don't fuck with Mother Nature Too much

Is there an acceptable amount of fuckery?",0.8104925053533191
That’s Awesome!!  I got 6:41 today on the strider and thought I was jamming.,0.15256959314775162
so basicly what you are saying here is that Obama was a felon. ,0.4534261241970021
I dont think it helps your argument to falsify the non-binary population; its something less than a single percent last I checked.,0.3961456102783726
"Looking to get a good $150+ headphone that is over ear and closed. I have a pair of ATH-AD700x open backed and am looking for a closed back pair. (sorry if thats not correct terminology) 

I'm looking for a good pair to use at home as well as take with me to occupy my time on the train or planes. 

I'm looking at the ATH-MSR7's but I hear complains about lack of bass. 
Sony MDR1a I hear has bass but lacks sound quality compared to the MSR7's. 

Any other recommendations at that price point? 

Edit: I am in Japan so I will not have the same exact prices as US. ",0.2082441113490364
"> To be honest it’s unfortunate that you thought you had to drink with your friends in order to enjoy your time with them.

I didn't think I had to. I don't have to do anything. It was still ultimately my choice. I enjoy myself with my friends in many different contexts. I allowed myself to be convinced to change up the context, and it led to a great night. 

> If we broke down the details, we would likely find that the reasons you enjoyed yourself were quite separate from the fact that you drank a depressant that filled your senses and slowed your brain.

Actually, no. I definitely enjoyed myself more because the drinks helped me to relax, get a good buzz going, and feel more social energy/ reduced anxiety. That's why so many people like to drink. ",0.4089935760171306
Yea for like 2-3 months and usually during the summer. The requirements usually aren’t that stringent and almost anything can qualify as an internship. ,0.30888650963597425
"Very wise decision , you would probably get 35-50 K in dividends per year. Either you can reinvent it , travel or go part time at work. Either way selling and investing it in market would be great . Sell and and wait couple years for recession/ market crash. You’ll get great value of stocks and a higher dividend. Enjoy early retirement if that’s what your looking for !",0.23072805139186298
"thats fucking hilarious, but also sad at the same time because I know it won't change anything.  Here's to hoping these laws get struck down, and old pseudo-religious trying to win political brownie points men stop trying to tell women what they can and can't do with their bodies",0.7548179871520343
"How the fuck does this post have 11.2k upvotes, when everything else on this sub has like 12? Oh, that's right, Russian propaganda is a thing..",0.8329764453961456
[deleted],0.6156316916488221
Sensitivity to whom in that culture. Cultures aren't some uniform singular thing. Not everyone within likes every aspect or respects every aspect so you are still choosing to respect the image and narrative put out by a group who's voice is the loudest. No one gets to decide what is or is not sacred for others. ,0.3752676659528908
"What is has no bearing on what should be, and that is what I am discussing here.",0.27516059957173444
Not sure why Im being down voted? Why does the truth bother so many people?,0.373661670235546
This has JUST the right amount of points,0.17505353319057812
"Dragonflies do not often live indoors and protect peoples houses from flying assholes and so lack a major part of a spider's ""dopeness""",0.5203426124197001
"Ok my specific example was an instance where a party needed more emotional support/attention than there partner was giving. I wasn’t assuming a greedy motive, but I guess if you want to make my example that then sure. I don’t think that we disagree in general. So I’m out of this thread lol.",0.4427194860813704
I'd rather see a percentage of stocks go to each household that had their taxes contributed to the stadium or some other structure that allows the people to benefit financially over time.,0.23072805139186298
"I mean I'm not anal about bass. I listen to rock and metal but I'll prioritize crisp good sound (for PC use) over bass. Do the mdr1a do well gaming though? 

Edit: I saw on the web the Bose true sound ae ii for travel and portability. Any word on those? Online reviews seem fairly good. Some bad ones. ",0.5214132762312633
"Oh, I got it. The difference between one and the other is that the prenup is something you have the option to take or not take. While alimony is mandated by law. So the difference is basically consent. If you want to sign your money away in case your partner decides to leave you for no good reason, be a fool and be my guest. You can also directly make a donation to that person.",0.5342612419700213
">they're still somehow pro Hillary and blaming Sanders for Trump being president

Perhaps because they are intelligent people tuned into politics?",0.4646680942184154
Meh. I'm not antivaxxer. Reddit teens just hate one anyone who psychologically represent their conservative Christian parents. ,0.5091006423982869
Arab eats camels and I tried it with my friend it is expensive but if there was a marriage they always put some camel meat with rice and believe me you will keep eating till your stomach explode   ,0.5091006423982869
"Whatever made him your ex, might be coming to the fore again this time. You situation is different because of that: you two have a history. ",0.4759100642398287
Have you ever bought a gun?  We have background checks.  End of story.,0.3977516059957173
“He’s a waitress” Oh,0.28640256959314775
I guess sucks being an anti vaxxer nowadays,0.6209850107066381
Fuck this sub. Islamic mod cucks ,0.9668094218415417
"Yes but in those cases, the animal decided it wasn't worth the effort to kill the survivor. Most wolves/bears/wild animals will run away from humans so long as they aren't totally surprised and feel cornered.

In the scenario OP put forth, a fight to the death between a wolf and a human would go very badly for OP.",0.5985010706638114
"Uh huh. And I'm sure you're a super duper special individual because you're on the other team and parrot FOX/Breitbart. Again, projection.",0.5572805139186294
"I'm using men because we generally want more sex than women, but it would be the partner with the higher sex drive not having their needs fulfilled. ",0.5985010706638114
you can still be a faggot and not be gay my dude. don’t worry ,0.7767665952890792
I'm going to the movies tomorrow and I can't decide between Game Night and Tomb Raider. Perhaps anyone here who has watched can give me suggestions? (No spoiler pls),0.2639186295503212
I can't believe what Zach said about David Sedaris!!!,0.2778372591006424
"This sounds waaaaay too real, especially the part where he refers to Sessions by his first name only. You might want to worry about being inside Donald's headspace too much.",0.49839400428265523
you're all over the place here. ,0.19111349036402567
"> It's almost as if these leave-voting money-grubbing pro-business Tory leaches know how much easier it will be to fuck everyone over without the EU getting in the way.

Odd, given how many Tories supported Remain...",0.8998929336188437
"Star Trek, too. If I could even be a janitor on the Enterprise, that'd be cool because I'd get to see cool new worlds, even at the imminent risk of being murderated by Klingons. ",0.17344753747323344
"Top comment pretty much.

I have gay friends and gay family, but i’ve also had gay guys hit on me or ask me out, i would turn them down nicely but it’s still a little weird they’d ask knowing i’m straight.

Also i had a guy that couldn’t take a hint and stopped me on multiple occasions saying graphic stuff and i’d imagine other guys have had similar experiences.",0.55406852248394
"I'm, like, a really manly guy. Everyone says so. They say ""look at that masculine guy over there. You see how normal his hands are? They're not small at all, and neither is his button. That's the kind of hands you want. His doctor said his hands are the healthiest hands in the world."" Remember, NO COLLUSION! ",0.4646680942184154
A good set of kitchen knives - Japanese or German steel,0.08565310492505349
Nazis germany wasnt religious. Quit trying to rewrite history to fit your leftarded narrative you dumb fuck,0.933083511777302
"Just to be sure, when you say she's ""married"" to somebody else, you mean she's married to, say, her friend Tina that she hangs out with all the time, and not her Ex-Husband. Right?",0.44164882226980723
Random Theory: The Vinsmokes (or Germa 66/associates) are the one who killed Brook and the Rumbar pirates. Brrok doesn't want to talk about it because it's hard to think about,0.5203426124197001
"I think that the big problem here is simply the of authenticity. 

I mean if you say that you make genuine Italian food and you don't you are attacking the idea of genuine Italian food by passing the crap that you are making as the real deal. 

Italians do have the right to be upset there. 

Same idea goes when we take rich cultures and turn them into mascots.  We take ceremonial garb of people we conquered and turn it into a costume. 

It isn't a costume. It is a sacred headdress. 

So if a non Italian makes Italian food, but they make the good stuff and uphold Italian cooking traditions than they should be fine. If they are simply riding the coat tails than people do have a valid right to complain.",0.4534261241970021
