text,y
"Every living thing everywhere has a ""genetic defect"".  Right now, you have at least one half of a gene that, if activated in your children, would lead to disastrous results.  If you have a kid with someone, they also put in that kid's genetic code at least half of at least one disease that you would never want to have.  It's only when the genes are ""active"" that we see the disease.  This is why inbreeding is so dangerous, and why homogeneous ethnic groups are at great risk for some diseases and at lower risk for others.  If you want to ban selectively breeding based on this, you'd have to ban all breeding in general.",0.5315845824411135
"People shouldn't be allowed to work for free.

Of all the things to complain about",0.4427194860813704
Hmm... the amount of people getting measles spiked right after people stopped vaccinated their kids... what a strange coincidence!,0.487152034261242
"Δ

Awarding delta because I am not necessarily arguing that there are no instances in which this is an ethical grey area, and disease research is potentially an exception. Although my post was intended to only discuss for-profit retail vanity breeding, it was perhaps unclear. ",0.4534261241970021
"> No it isn't, that's just wrong. An hydrogen atom is not the number 1 and an oxygen atom is not the number 1: otherwise an hydrogen atom and an oxygen atom would be the same thing.
> >Now you're playing a game.

Lol this guy is an A+ troll.",0.487152034261242
"Yet again, there will be no consequence to this blatant conflict of interest and misuse of power.",0.3977516059957173
"Star Trek, too. If I could even be a janitor on the Enterprise, that'd be cool because I'd get to see cool new worlds, even at the imminent risk of being murderated by Klingons. ",0.17344753747323344
46% of the US voting population.,0.19646680942184153
"How could you physically pick him up and spank him, or restrain him and spank him without physically moving? ",0.55406852248394
"Those fucks that constantly annoy you by giving you all these tips and suggestions every other day and criticise your workout routine. 

That one guy who comes to the gym just to flirt with girls and sits on the machines. FUCK YOU MOTHERFUCKER I WANNA DO SOME ACTUAL WORKOUT. 

Sweaty fucks who don't wipe after they're done ",0.7880085653104925
[deleted],0.4759100642398287
lowkey salty the mods removed this thread due to breaking rule 3. thanks though for anyone that joined in before it was removed and put in great content,0.4759100642398287
"> Because once a biological woman has undergone sex change or transitioned, they are then a male.

This sentiment supports the concept of your sex/gender being based on your external physical attributes. It ignores that your brain is very much a physical component of your body, and it's there in the brain that people are Male or Female or SomethingElse.

There is no ""becoming a woman"" or ""becoming a man"". There are only techniques people use to make their outward appearance align with their internal sense of self so they don't feel a jarring reaction every time someone says they are something they are not.

I would strongly encourage you to educate yourself more on this issue, because you'll draw a lot of false conclusions if you don't understand the nature of how sex/gender really behaves scientifically as well as socially/culturally.
",0.5572805139186294
"Exxon-Mobil certainly doesn't own Trump. He picked Tillerson because he's the CEO of the (top 3) largest company in the world. The man is one of the best businessmen on earth. 

They're peers. One does not ""own"" the other. ",0.38650963597430404
Ugghhh....that sounds like a slightly longer process than a snap.  I hope I never hear either sound.,0.2938972162740899
"*All reported and recorded crimes

Not every crime is reported, and not all crimes reported to the police go into the books (for one reason or another, not always corruption).",0.3977516059957173
It does if she credibly claims that he did. I’m sure every rapist in the world who has “met a lot of people” would be touched by your support.,0.5315845824411135
"Trying to kill envy in darksiders 3. 
God I hated envy, wrath wasn’t any easier and I haven’t played it since I “killed” wrath ",0.487152034261242
[removed],0.9668094218415417
"For me is the lack of actual existence, i take the scientific method to heart.

There is currently no way to actual prove his existence, therefore God does not exist.",0.5315845824411135
"I don't include child support in this discussion, as it has other issues that might detract. Division of marital property is a hard question. I would say if it was acquired in tandem, it should probably be split equally, but I'm not too sure.",0.43147751605995716
Random Theory: The Vinsmokes (or Germa 66/associates) are the one who killed Brook and the Rumbar pirates. Brrok doesn't want to talk about it because it's hard to think about,0.5203426124197001
"Socialize loses and privatize profits.

This is why these telecoms and cable companies love corporate welfare. Then they turn around and try to fuck over their customers with shenanigans like repealing net neutrality.

It's almost ironic how they pander to us when they want something, and then turn around and ignore our concerns when we want something.",0.7548179871520343
Im so sorry hope he get better,0.07441113490364026
I'm willing to bet if he took his child to the doctor and explained the situation the doctor wouldn't tell his wife. Kids are dumb AF so I'm sure it wouldn't be too difficult to convince him they were doing something else.,0.6991434689507494
"No one's mentioned Vision yet, who actually did.",0.2526766595289079
"I took a cursory look at your posting history and found out you were processing for the National Guard, which changes things.  What's your end goal here? Just to be aircrew?  I have to tell you, enlisting as 15T or 15U doesn't guarantee a flight slot.  I know people that spent 20 years in either an AVUM maintenance platoon or AVIM company and never crewed.  If your goal is WOFT you need to just work on and submit a WOFT packet (or whatever the Guard version of it is).  I'm not trying to talk you in or out of anything I'm just sayin'.  

Oh and 15T is the best job in the Army.  Source: I'm a 13 year 15T with a couple thousand hours flight experience.",0.38650963597430404
It's coming. We all know it. Have any of you ever seen a grown man who blames other people the way this clown does? Hire a clown expect a circus! ,0.4759100642398287
I would steer clear of those in the future if I were you,0.3094218415417559
"In the way that he behaves on Twitter, yes. In the way that he conducted foreign and domestic policy with no regard for the constitution, nah.",0.36456102783725913
"No, they care about political support. 75% of politicians don't actually give a shit about anything that happens as long as they get reelected",0.7435760171306209
Then add a clause that makes it so people don't have to accept prostitution positions to get benefits. Making it illegal just to accomplish that is ridiculous.,0.6209850107066381
9 downvotes but no comments? I wonder why.,0.4089935760171306
Fun fact when Andromeda and the Milky Way collide in a couple billion years not a single star is expected to collide from either galaxy that's how soul crushingly vast space is and it isn't even as isolated as OP would feel right now.,0.4759100642398287
"I don't think uncomfortable in this context is referring to either party on screen, but rather the general vibe a viewer would feel while watching. ",0.3849036402569593
"I like where this is going... imagine how much we could save if we prevented most people from having children! On the flip side, imagine the long term negative impact of less workers... hmm. Maybe it doesn't work to be utilitarian about this sort of thing?",0.4427194860813704
Look the budget was 8 million for renovations before the fire. Now the fire happen and now they get 800 million. You can predict who burn the church and where the rest of the money is heading. All roads lead to Rome.,0.3244111349036402
"For every action, there is a reaction. This is simple law that is true for physics and also true for humans. If you invade a country, torture it's people and rape men and women and murder their kids and destroy their places of worship, they won't give you back flowers. 

These war crimes fuel terrorism and they are the biggest contributors to it. This is how ISIS manage to gather people through media. ""See the west how they are killing Muslims and commiting ugly crimes against Muslims... etc"" Angry and misguided youth will react and joint ISIS. 

The fastest way to end terrorism is to stop the ugly war crimes, which should be called by it's name organized terrorism.",0.6541755888650963
"Simply put, we don’t have unchecked capitalism in healthcare, advertising, education, the wide expanse of insurance markets.  They are all heavily regulated at the federal and state level, subsidized, subject to quality controls and legal liability, and criminal exposure as well as enrolling openly to both those who can afford it and those who cannot.  So if it’s not unchecked, perhaps we can focus on multiple priorities at once.  Like national security, retirement, social welfare, housing, transportation, foreign aid, and the environment.",0.4202355460385439
Cancer bats. Hail destroyer. Im in the middle of learning this and the intro is really fun. Plus the band is sick as fuccccck,0.7210920770877943
"How many years of GOP led investigations that came up with nothing? How many, fuck face? ",0.9443254817987151
Same here is Sweden atlest since my dad was a scout during what the late 70 to the early 90. ,0.23072805139186298
Wait is this really you? That courageous man on my tv lol,0.28640256959314775
"Late last season, off the back of an upset win against the Swans, the SUNS were brought back down to earth by Carlton, with a 35 point loss.

Late this season, off the back of an upset win against the Swans, Carlton..... to be continued.",0.3533190578158458
"So if you let your child play on a main road and it gets run over you probably get charged with criminally negligent manslaughter.   
If you let your kid play on the road and a car comes along and hurts your kid(severely) you still get charged with criminally negligience.   
If you let your kid play on the road and a car comes along and brakes in time, but still calls authorities you probably still get charged with criminally negligience, because of what could have happened.

So with this in mind could you explain why you want to see parents punished if their kid dies, but not if it merely gets infected or merely is under risk of infection? Shouldnt you ask to simply make vaccines mandatory?
",0.6322269807280514
I can’t wait until I can call ICE on Barbara down the street for propagating diseases to be quite honest. Which island should we use?,0.4989293361884368
"did u win it or what??? 
",0.23126338329764454
"I don't know.  Sitting here now answering this question on Reddit, I'd turn her down.  I'm not interested in casual sex.

But if this actually happened, I don't know that I could refuse.  I'd like to think I'd be strong enough to.  My lizard brain might take over.",0.5455032119914347
I cannot begin to fathom your pain. You have a long road ahead of you and I wish you the best in this darkest of times. I am truly sorry for your loss. ,0.2082441113490364
"If you really are open to changing your view, consider this:  what constitutes a ""genetic defect"" is highly subjective.",0.31959314775160597
Change my shorts shortly after realizing the alien invasion.,0.34796573875803
"This may be purely anecdotal on my part and I admittedly don’t have stats to back this claim up, but I feel based on my experience that most young people lean Democratic, and the ones that are Republican are either very religious or have embraced the alt-right platform. There are very very few young Republicans who abide by the social freedom platforms. They’re almost all against gay marriage and immigration reform. They want to ban both. ",0.55406852248394
"Seven extra men at the beginning of every go, *but you couldn't fucking hold it*",0.9105995717344754
"But you are still cooling your ""hot"" chocolate with whipped cream. Milk doesn't retain it's heat very well, so you end up with luke warm chocolate milk",0.2082441113490364
Doesn't the continuation of the Patriot act qualify as a violation of the 4th amendment ?,0.31959314775160597
Ok fuck this judge. I read another thread about this case and all the comments were anecdotal stories about slutty opportunistic tween girls. I'm not saying they don't exist. It's just real fucking simple you don't  have sex with them and you don't pay for sex with them. Period. These are kids we are talking about not 30 year old women. ,0.9105995717344754
He’s a good doctor in my books since he can administer the shot the time around. Imagine some boob poking you multiple times since she cant find the vein. Im 9% bf ,0.5203426124197001
"**Game Corner**

Talk about video games here!
",0.18576017130620984
"Once you make an affirmative claim like you just did: GOD EXISTS..


Now you have the small problem of showing evidence for that claim. And you have none. 

you are starting with a conclusion already in mind and then matching things to meet that conclusion which means that you are swimming in confirmation bias. You are just keeping what you like and getting rid of what doesn't mean your final conclusion. 

you make any claims that you want. They just are useless without evidence. 

Can't you see that anything you can do to prove my God, I can do to ""prove"" the the invisible flying dragon I just made up.

Believe in it all you want. Believe deeply. But you haven't proven anything since you don't have any evidence. ",0.6097430406852248
"This kind of education is what reddit needs!!! Please if you are interested in this topic and discussion, this is a must watch!!",0.31959314775160597
Factually wrong. The growth in the EU is beaten by many other countries around the world. Pointless response.,0.5765524625267665
So now Ianquinta thinks he should get money fights too. ,0.3533190578158458
"It's not by choice. The same way people don't choose to become drug addicts, or gambling addicts, etc. There is a psychological, subconscious motivation. We all have our pathologies, and most of us can keep them in check and hidden for the most part. Some people can't help but wear them on the outside.",0.3977516059957173
Slam into the alien spacecraft in a crop duster,0.38650963597430404
"Eh doesn't really matter re: cleanliness surrounding you. You just need an alcohol swab and a clean needle. During my training back in the day, I went to a rural part of Uganda and mothers would line up for hours to get their kids basic vaccines. We did them outdoors in front of one of the hospital buildings.",0.36456102783725913
"If you drink it quickly, and the whipped cream is the real thick good stuff. Then it can be amazing. But it does melt quick which sucks. So get it down you. It's the difference.",0.36456102783725913
The second comment got a bunch of downvotes  for a s(he) be(lie)ve(d) joke,0.3849036402569593
"Tangential question:

Would you prefer they just called people 'effeminate' to their face?",0.5101713062098501
Republicans always have the most radical and prehistoric ideas. I’m independent but dam GOP is really fucked up.,0.7880085653104925
"Hard worker but can sometimes drone on and on

",0.4202355460385439
"Honestly in the market today, I don't see that kind of long-run appreciation that people saw over the last 20 years.

If you don't like property, sell it and put it in other investments (diversified) and safe outlets of your choice.",0.33083511777301927
"But its safer for me to not leave my house. Less potential people is more safety.

I mean airlines already offer this service, its called a chartered flight.",0.3420770877944325
I hate that AMP crap whenever using google now,0.5653104925053534
Holy fuck this is a lot comments almost copy/pasting the exactly same 2-3 things about headline /berniebros/fake news.,0.8886509635974303
"I mean, I'm not particularly invested here. If you came out with some navy seal copypasta sounding story I likely wouldn't believe you. It's more that I find a lot of people take for granted their ability to handle panic situations well. 

I've been in a bunch of them. Sometimes I handled it really well, and a few times I broke and just lost my shit. Once I just shut down and walked away in a fugue. 

Its a hell of a thing man, and I don't know that I could count on it in that context.  ",0.5342612419700213
"Fuck me thats smart, where can i get one?",0.6766595289079229
"Capitalism is great at providing basic needs. ""Society"" doesn't need to do anything. There is no such thing as a guarantee as evidenced by literally every attempt at socializing food ever.",0.5342612419700213
"I lost a fuck ton of weight and while women weren't throwing themselves at me. I got treated nicer and got much more smiles from strangers.

BUT, whether this was because I was more attractive or because I was much more happy/confident/smiley/approachable I will leave to the scientists 

(but I personally think it was because of the latter)",0.7548179871520343
"Well yeah they don't give a shit about her internally, they just use her as the villain they have built up to cover up their evil shit they do. 

They could care less about Hillary except as a distraction.",0.7103854389721627
It needs to sold with a penis shaped ottoman so I can make the international sign for boning with my furniture.,0.5315845824411135
"Let’s try this another way. There is a clearly marked men’s room and women’s room (single occupancy). There are 4 men  and three women in the respective lines (with the understanding that more people will add to the line within the next few minutes because that’s how bladders work). Are you saying you think it would be smooth sailing if you were to get into the shorter [women’s] line? Obviously you will get some funny looks at a minimum and even though it’s single-occupancy, I will wager that your presence will make the women uncomfortable.

Am I wrong? Am I misunderstanding your argument?",0.4759100642398287
Monty Python. Watch all of it. The movies and the series. ,0.14132762312633834
This would definitely be a Dudley line if the first Harry Potter was written now. ,0.21948608137044967
"I feel anyone who takes the time to respond to my CMV deserves a thoughtful response, but that doesn't mean I want to get sidetracked to an entirely different CMV",0.3752676659528908
The best way to handle a mid-life crisis.,0.28640256959314775
"The scientific consensus, as you are aware, is that spanking is ineffective and will likely have negative unintended consequences. The onus would be 100% on you to prove that despite the scientific consensus, you are right and its fine or even good to hit children. 

Can you prove that it is ever appropriate, or even just ok, to hit children? If you can't do that, you probably shouldn't be experimenting with hitting your own kids. ",0.5653104925053534
"What's frustrating is that most build questions are answered by 'well, go on ffbeequip and put your stuff/unit, we cannot say otherwise?'. The questions are so specific sometimes that it feels people just want to show off their long STMR list and ask what they should farm/UoC now. Seriously, you're rank 180+, you know the game and you know your account/ressources far better than us, duh.

The ""what should I UoC"" are so frequent too. I just want to say ""well, if you're asking what to UoC, then you probably don't need to use your UoC. If you lack a role, you won't thing twice about what to get, the rest is pure epeen and epeen is a matter of preference"".

Sorry for the rant xD",0.55406852248394
"so I've got piston 3s and I'm looking to get to the next step.

girlfriend has a pair of the MEE M6 pro - they're pretty cool, I like the sound especially w foam tips.

I'm actually kind of looking for cans this time around, but the thing is that I prefer an open back headphone with punch - something that has bass and a very ""live,"" fun sound but not something v shaped to the point where it's tiring to listen to. I prefer open back because of the sound stage.  I've tried ATH M50x's and they sounded really congested and bad to me. 

any suggestions for an open back headphone that doesn't rid of the bass or ""fun"" sound?

it's almost as if I'm looking for a pair of speakers with a sub for my ears lol",0.3977516059957173
well unfortunately they can do anything. they have all of the power ,0.33083511777301927
"If you dont see it in your post, youre probably blinded by your own righteousness, and me pointing it out won't actually do anything. But since you asked;

> Ideas created by straight white Christian males.





",0.6065310492505352
"No source other than cringey op-eds that lack any quotes, just liberals being antisemitic and not realizing it because their heads are so far up their own asses.",0.6991434689507494
"I prefer when they call me ""papi"".",0.24785867237687367
the space differences dont allow for this,0.18576017130620984
"Based on what I've seen, you may not have bricked the system. I believe that ""borked"" is the proper term here.",0.27516059957173444
[deleted],0.5203426124197001
Nice! What method did you use? I deflected the crap out of him.,0.4759100642398287
" If you're curious, In SG we sort of love Obama",0.23126338329764454
Broke ass but at least we get to live.,0.6322269807280514
After watching Stranger Things start to finish two times in a row: The Clash - Should I stay or should I go. ,0.28640256959314775
Gordon Keith has a calm dark sense of humor. He is a radio host during the day with The Ticket and does these type of interviews as a side gig. ,0.2639186295503212
I think it’s more if you have less fear of going to jail. That way you can really do anything. I am betting that’s more a motivating favor than ethics or morals,0.4646680942184154
"this one is a beast. Runs for three days straight, then you just charge it for about one hour at lunch time and it's 100% again, ready for another three days. Absolutely love it.

Not that great of a camera though, but I couldn't care less",0.30139186295503206
"I know a flamboyant gay man personally. Its not just wearing the makeup it’s pointing it out. None of the female friends I’ve ever had needed to flaunt their nail polish to me. My girlfriend does yes but our relationship is more intimate. Now my flamboyant gay friend does not have a very intimate relationship with me. Yet they felt the need to point out their makeup, nail polish, etc.

I don’t ask my female friends about their makeup why do i care about a gay persons. I feel like that qualifies as pushing their gayness in my face. As you may be able to tell im not a homophobe. Im still friends with him.",0.6541755888650963
Adults that think they can meme politics,0.27516059957173444
"This will guarantee the magazine is seen by not only everyone at the school, but by people all over the world. What a bunch of fucking morons. I would have literally never even heard of this magazine had they not done this.",0.7767665952890792
What should they do? Welcome Hamas with open arms crossing the border? ,0.4534261241970021
"As a male, I like this and I think it goes both ways for both men and women. Sucks for your buddy, but hopefully he'll move on and not ruin his friendship with the girl.",0.43147751605995716
Already do. Still waiting for my discount.,0.33083511777301927
"Jesus Christ you people live a sad life eh?

At least I'm happy enough to just imagine how I would torture and kill random bystanders on the street—especially those with short hair.",0.6654175588865096
"There are some experts on the subject of whaling in Japan who announce that the departure of Japan from the International Whaling Commission is good news. That is because Japan has not respected this agreement and due to its traditions, it continued killing those beautiful animals of the marine world. At least Japan is being honest.

The decision of Tokyo is a provocation in the eyes of Australia and New Zealand, outraged by the annual Japanese expeditions to Antarctica.

Surely that should not be the case. Something must be done since the threat of disappearance of some species is a reality.

&#x200B;",0.4534261241970021
"Probably not. This is why I refused hep B and vitamin K for my newborn, which are given shortly after birth. He’s not going to get an STD anytime soon and he wasn’t circumcised so there was no need for Vitamin K. ",0.4759100642398287
"Marshmallows get more disgusting when you start thinking about what's in them...boiled animal cartilage isn't exactly appetizing.

Also, presenting the false dichotomy between marshmallows and whipped cream completely disregards the best thing to add to hot chocolate...peppermint schnapps!",0.31959314775160597
"Its the whole reason there are two bathrooms in the first place. Men dont care if women use theirs, most women are going to flip out if a man is in their bathroom",0.5428265524625268
"Israel and the West sure as fuck do have airplanes..

And surface to air missiles can also be used as surface-to-surface missiles",0.7660599571734475
"You seem to have forgotten the benefits of alcohol.

It doesn't only have downside, like any of the drugs that are consumed regularly around the world.

What he describes sounds like he was able to get a little bit more comfortable due to the alcohol.

That initial boost in comfortableness could very well be what's made it possible for him to have a good evening, sure he likely could have got the same effect through other means but that doesn't make it's a bad thing.",0.487152034261242
