text,y
"Nope. Just a low risk, get to know you date. I don’t get pulling out all the stops for someone on the first date, unless it’s already established that there’s a deep enough mutual interest that will last longer than the first night.",0.29764453961456105
That’s a really rough run home for Gold Coast.,0.36456102783725913
"The main sub goes through phases like everything else. And I feel like there have always been easily researched questioned asked on the DHT, and players posting ""questions"" just to show off their rosters. Aside from a few too many Fan Unit Contest threads, I'm fine with it over there. I prefer hanging out here anyway.

As for downvotes, I generally only downvote people being asshats - rude, insulting, ignorant, dismissive. Though there are two users I downvote on sight. One is a homophobic shitbag who said something vile on the main a few weeks back and the other is a notorious longtime troll who needs to eff right off. I like them both to know they're not welcome, even if it doesn't do anything.",0.6766595289079229
"So.  Just a little petty theft and vandalism?  Should be enough to get the perps fired from the Uni.  

This post has about 10 miles of comments, and not a single one asking if a crime has been committed.  Did I not understand the article?",0.4646680942184154
"Not me, but my best friend. She got pregnant last October and aborted three weeks after she found out (found out when she was 8 weeks, so aborted at about 11). She knew she wouldn't have the support of her family and her now ex told her he wouldn't pay child support and told her to abort. It messed her up pretty bad for months after the abortion and she still suffers from guilt and sadness about all of it to this day, but I know she knew it was the right choice for her and she would do it over again. It's incredibly important to make the right choice for yourself. Love and hugs, OP xo ",0.4089935760171306
As a former collegiate runner who’s done 5ks at sub 6:30 pace and is looking to break 8min today you CRUSHED it :),0.20235546038543897
"I'm dragonflies are way scarier than spiders, not in the ""that could kill me"" way, but in the, ""that thing looks gross and I'd rather not have it touch me pls"" way",0.3977516059957173
I would like to hear your argument against Mountain Dew...,0.27516059957173444
"""I just broke up with someone.""",0.2526766595289079
Stop killing lobbyists to make vaccines,0.5444325481798714
"Fuck those motherfucker tiny-dicked Chinese and SouthEast Asian men. Fuck them with a shrapnel dildo that deposits ground glass in their rectum and kills them painfully.
And fuck the hunting apologists too.",0.9443254817987151
Well for one it could be as entertainment to make fun of people deemed crazy or bieng so absurd that secondly people just make fun of them because maybe there life just sucks and there bullies. Also females use these terms too,0.5428265524625268
"7:52, a new PR!",0.2082441113490364
"Δ

Awarding delta because I am not necessarily arguing that there are no instances in which this is an ethical grey area, and disease research is potentially an exception. Although my post was intended to only discuss for-profit retail vanity breeding, it was perhaps unclear. ",0.4534261241970021
"You cannot rape the justice into a situation, only the vengeance. ",0.7548179871520343
"Donald Trump:  ""I'm not really religious, and I used to be pro-choice.  But now that I'm milking the republican base, I'm going to impose their beliefs about abortion on others.""",0.49839400428265523
"I am using Fostex T50RP Mk3 and they sound great. They are entry level planars and are about $159. This specific model is semi open but they dont have terrible leakage at all. Ive used at home and at work without any complaints and theres sensitive people around in both places haha. They also make an equally priced closed T40RP Mk3 model.

Edit: for something pricier closer to msr price range, i just recently picked up the Audeze Sine and they are great for a portable. People seem to enjoy the Oppo PM3 too, as well as the NAD HP50s.

",0.2526766595289079
Ask them What took them so long??,0.2082441113490364
"Okay, I live in KS and I am trying to look up where I can vote on this. The 3 kansas websites I've pulled up have either been outdated or provide no information. Could a fellow Kansan help out?",0.28640256959314775
Just amputate it like the good ol’ days of medicine.,0.487152034261242
"If we're being honest, that sub is mainly a refuge and safespace for patrons of it to say and write disparaging things about diffrent marginalized groups and hide it behind a thin veil of ""it's a joke"" as if that negates the abhorrent content. Interestingly, I don't see a comparative number of jokes about white straight males with stem degrees being the subject of laughter and ridicule, that isn't coincidental. How come, we share one of our mods with that sub?",0.6541755888650963
Yeah... So? If the person who made the choice to take a loss of income make then the unilateral choice to leave for no good reason... Why should they get anything. Remember that I am not talking of when the person that benefitted decides to leave them.,0.430406852248394
"I actually think if the players were making an earnest pretest about a veterans issue that's anymore complicated than a bland ""Support the Troops"" you would get a similiar blowback. 

American is probably just as unwilling to confront it's status as a world police force that uses it's young, largely rural population; largely from historically military families - thereby concentrating the burden of service.

If the players were to protest to an end to all American interventionism. Or the closure of all foreign bases in countries we ended wars with 50+ years ago. Or for a total end to our drone assassination program. The point is both the fact that there's an unpalletable protest (black people are humans) and that it's occurring during America's Sport - a time for escapism from what's increasingly a state of total politicization across all aspects of life.",0.5315845824411135
"> and one of them is a woman. 

OH SHIT we better bust out the Tomahawk missiles then.",0.7210920770877943
"You know, I wouldn't be suprised if Sanji cut ties with his family because they kept fighting over girls.",0.34796573875803
"People need to actually read into this instead of reading a headline and automatically assuming this guy is a “ psychopath murderer”. There is absolutely zero evidence any of this actually happened besides hear say talk. So with this logic, if someone comes up to you and tells you that you murdered someone, you’re automatically a murderer even though there is absolutely zero evidence proving that you did it. Ever heard of “innocent until proven guilty”? I’d advise people to actually look into this story before throwing out all these wild accusations.",0.4759100642398287
"People Kill People.
One Man Killed 17 People.
But He Killed Them WITH A GUN.
So What Is Your Point?",0.6209850107066381
I use them to my close friends bc I think they’re funny.,0.24143468950749467
"No, we don’t have universal background checks.

Privates sales including at gun shows by private dealers are not required to have background checks. 

Only federally licensed dealers.

Are you going to stop lying now? 

It shows how lame the gun humper argument is. ",0.5985010706638114
"I don't know how people consistently get more than two clicks in... Without fail, I die on click #3. ALWAYS.",0.43147751605995716
"This may be purely anecdotal on my part and I admittedly don’t have stats to back this claim up, but I feel based on my experience that most young people lean Democratic, and the ones that are Republican are either very religious or have embraced the alt-right platform. There are very very few young Republicans who abide by the social freedom platforms. They’re almost all against gay marriage and immigration reform. They want to ban both. ",0.55406852248394
"Pretty much the same as when straight people push their sexuality in my face. Things like being overly intimate in public places. I don't need to see two people playing tonsil hockey and heavy petting while I'm waiting to order my latte. As long as you can read a room and have some sense of decorum, you do you.",0.49839400428265523
"I've never seen people kneel during services for veterans, such as military funerals.  They give the military salute.",0.21948608137044967
"Excited about the new show! 

I've not yet watched it, probably won't get to till tomorrow. I don't want to pass too much judgement before watching but I fear that getting two new owners backed by Angels/VC and my friend /u/esportslaw who represent teams might not have the most objective stance?

PS: I like all 3 of them, just an observation :) ",0.3276231263383298
"As the female primary breadwinner in a hetero marriage that works well, I personally find her comments (as a woman) to be icky.  But I'm not you!  If it's a joking or fetish thing that you two enjoy together - totally fine.  But for me, I don't even like playing around the idea that the home-maker role is assigned to women - it's a touchy subject for me living in a social context that is still frequently anti-feminist and anti-men-doing-things-that-aren't-traditionally-masculine (there has to be a better word for that).  She's not doing the male thing - she's doing her thing.  You're not doing the female thing either.  BUT, as long as no one feels uncomfortable, and she's not making those comments to me?  Fine - none of my business, and enjoy!",0.4202355460385439
"The Stand
The Green Mile
The Harry Potter series
She's Come Undone
Ishmael",0.28640256959314775
"Yeah right, but those trials vids were fun to watch and talk about :D",0.18576017130620984
There should be a very real concern of the idea that Hamas is using Palestinian civilians blood to propagate global attention.,0.5653104925053534
Tell my Facebook news feed that.,0.21948608137044967
I remember at a sort of secondary school where I took a class to learn a little about specific trades. One kid would get bullied a lot in there. I remember exactly who did it. It was mainly 2 different guys and I could easily name 5 people that saw it happening. Granted it was about 5 years ago rather than 36. But if it’s been so long you don’t even remember what happened. I wouldn’t suggest trying to make a case out of it. That’s just assuming it’s even true. ,0.4202355460385439
"I don't think so. Maybe if the EU had not expended so fast and so far in the East; but now it's become too big and diverse for that, I think. ",0.487152034261242
Why the hell wouldn't it,0.4202355460385439
Zach's in on the joke...,0.11884368308351176
"Completely agree. This is technically a ""first world problem"" but it's still an actual problem.",0.21413276231263384
I haven’t thought of that theme song in over a decade but reading the artist and title in your comment just now made it start playing in my head. Brains are wild!,0.28640256959314775
">killing it

...at golf.",0.27516059957173444
"> No it isn't, that's just wrong. An hydrogen atom is not the number 1 and an oxygen atom is not the number 1: otherwise an hydrogen atom and an oxygen atom would be the same thing.
> >Now you're playing a game.

Lol this guy is an A+ troll.",0.487152034261242
His point is that doctors DO need to know your actual sex or gender? It's incredibly medically relevant.,0.2639186295503212
"Here’s the thing. If a doctor is *so* Christian that they don’t want to perform abortions.....they won’t offer them. 

Gasp. 

Go to a different doctor. One that is more enlightened. 

Same as a fucking cake guy. ",0.8329764453961456
"The NFL is a company. The players are employees.

Some of the employees actions made the company look bad. And therefore, lots of income was lost.

Any company in the history of business would put an end to it. Make your political statements on your own time, not on company time.",0.49839400428265523
"being inactive puts you in a horrible spot

trying to renegotiate when you already have a fight on your contract is fine, but forcing them to pull you due to compliance issue is a bad measure. diaz brothers get away with it if they perform, same for connor but the second they don't they will be held to those higher standards you now stand",0.4202355460385439
"You know that Milk gets a skin if you heat it too much, right? 
I mean I purchased a machine that heats milk for hot chocolate and other heated milk drinks. I have that as high as it goes. While that is heating I boil water in the microwave, and pre-heat my contigo mug so it's as hot as possible. It still cools down fast. ",0.31638115631691643
"well shit....I have dyed hair, visible tattoos, AND 00 gauges...

I guess i better go suck a dick, apparently i've been a raging faggot this whole time.",0.8886509635974303
I believe NY state has a pending lawsuit with Verizon over this . They promised to make high speed internet accessible to every person in NYC for a couple billion but they used every loophole in the contracts to not deliver and kept all the money ,0.38650963597430404
"I suppose pressuring is a bit broad of a term, but I'm not sure if there's a better word to describe it succinctly.",0.30888650963597425
The Simpsons Hit and Run. ,0.27516059957173444
Expect nothing but be prepared for more. ,0.19700214132762311
"Not only that, but he's clearly stifling laughter. ",0.2639186295503212
"> Just like how progressives didn't show up for Hillary and Democrats down ballot despite the threat of Trump.

I don't think Trump was perceived as a threat, really.  He was lampooned even as he was hours away from winning the election.

I think a lot of people didn't seriously believe so many millions of Americans were willing to vote for such a candidate.  That so many regret their vote now doesn't change the fact that the party's decades-long effort to destroy public education and dismantle the fourth estate with propaganda has been extremely effective.",0.5444325481798714
"Only if you don't understand how to read axes on a graph.

Exaggerating the differences is a perfectly valid reason to truncate an axis. If you don't, you won't have room to put other information on the graph, like labels for different lines. ",0.3977516059957173
Thompson got a bunch of money to start and then a ton in the last few days! So our guy has plenty of money to spend. He needs phone banking!,0.36456102783725913
"Have any particularly good links? 


",0.21948608137044967
"Don't worry, I'm picking up good vibrations.",0.1568522483940043
I was reading this like “Doctor Who” linked vaccines to autism and was thinking “Wow that show really is going downhill.l,0.6209850107066381
Sometimes there is good censorship.,0.28211991434689504
"Wow, it is seriously starting to look like China, for the next decade at least, Might be the global economic leader replacing the USA. At least if current trends contiune in both US and China.

By that I mean increasing conservatism and xenophobic hysteria in the US. And decreasing government control and decreasing isolationism in China.",0.4646680942184154
"That is akin to saying the earth is flat, because that is what your observations tell you, and damn be the experts. OP, who made the initial claims, and those who agree with OP in this thread, are the ones who should provide evidence for their views, not the other way around. ",0.3752676659528908
"**Budge**t - $60  
**Source** - Bluetooth from Iphone 4s  
**Requirements for Isolation** - Not sure. Will use in outdoor gym, maybe for running. Maybe..  
**Will you be using these Headphones in Public?** Not really too much. Maybe running (maybe)  
**Preferred Type of Headphone** - Full Sized
**Preferred tonal balance** - Balanced  
**Past headphones** - N/A
**Preferred Music** - Probably workout music, so I guess more like metal, but I actually love Nujabes too so.  
**What would you like to improve on from your set-up** - Just over ear, good for working out, no whistles/bells.   ",0.29764453961456105
"Can you guys annex Colorado please? Put us under your wing until this whole trump storm blows over?
",0.29764453961456105
"You know, I think it's about time for women to come to the fore, I would imagine the sleaze factor would decrease significantly... ",0.3420770877944325
Now I regret not visiting it.,0.19111349036402567
"Eh, parents care and we should care, to a degree.

Sex has risks and can lead to more than just good times. I think it is prudent to educate and help mitigate the risks and bad outcomes of sex. Not just all in or all out.",0.487152034261242
"yeaaahhhhh, no. I mean I like the idea, but it's just not how it works, is it? ",0.27516059957173444
Playing vanilla WOW and being killed in battlegrounds. So irrationally mad. ,0.4759100642398287
The pharmacy should at least have to cover the expenses the consumer has to pay if they were to actually become pregnant and carry that child.,0.487152034261242
"What I'm doubting right now is whether this administration is abnormal, or if it's the true face of the Republicans and all that talk about liberty was empty.  Like I've been saying, economic liberty and nothing else.

And what confuses me is that most people support the majority those of civil liberties.  Even most Republicans voters support marijuana decriminalization, so the lawmakers could pass a law like that with very little blowback.  And nearly everyone supports offering protection to the Dreamers.",0.5091006423982869
">Alternate Vaccine Scheduling

Is that like the pullout method for viral RNA?",0.4089935760171306
"Soulsborne series? (Dark Souls 1-3, Demon Souls, Bloodborne)  
The learning curve is bit high, but you should try it",0.23072805139186298
I love everything about this.,0.04122055674518199
"Wow.

That's just *terrifying.*",0.3276231263383298
"They have choice you are right. I think we are seeing a bit more hesitation now as we have seen the duration of arena's in the 21st century (30 years is ancient). So we've had time to see the economic impacts and that kind of cash has to have some to the average Citizen. Going to a game is a choice too, burdening the tax payer is tough. However, I often think they should help subsidize arenas. I think the math needs some honest evaluation in these cases.",0.43147751605995716
"What happens if you can't prove fault, but it exists?",0.28640256959314775
"They're big on gun liberty which I think is overrated. I'm with you though as a Libertarian who used to vote Republican. They're pretty much a garbage party imo. They're ""lowering taxes"" are basically just megacorp handouts in the form of borrowing. I want conservative economic spending as a Libertarian. Both parties light lots of money on fire, but if I have to spend money, I'd rather it be for poor people and general safety nets rather than for wars and megacorps. Plus Dems are actually generally sane when it comes to social rights that actually don't cost anything.",0.5203426124197001
Anyone who thinks they can take on a wolf is deluding themselves.,0.38650963597430404
"Heck, I’ll do it for 50k!",0.17505353319057812
everyone was really angry about it for some reason but I think he's actually a good basketball player. ,0.30888650963597425
It's the good advice that you just didn't take.,0.27516059957173444
"> It's the difference between the WNBA and NBA.

I'm not saying this isn't another can of worms entirely, but I've heard that this is primarily because the skill level of the players is not the same, the games are less exciting, and the stakes are lower. That feeds back on itself.",0.3752676659528908
"If I were you I would cancel my subscription and download adblock until YouTube fixes the recommendations; they are beyond broken right now! I'm getting recommended tons of random videos that don't even slightly relate to my watch or search history! The amount of times I've seen videos from NBA is unreal, they keep showing up despite me saying not interested on them along with a plethora of other videos I have no interest in.",0.3945396145610278
Do you wanna be a fucking sandwich artist?!?,0.8442184154175588
"For every action, there is a reaction. This is simple law that is true for physics and also true for humans. If you invade a country, torture it's people and rape men and women and murder their kids and destroy their places of worship, they won't give you back flowers. 

These war crimes fuel terrorism and they are the biggest contributors to it. This is how ISIS manage to gather people through media. ""See the west how they are killing Muslims and commiting ugly crimes against Muslims... etc"" Angry and misguided youth will react and joint ISIS. 

The fastest way to end terrorism is to stop the ugly war crimes, which should be called by it's name organized terrorism.",0.6541755888650963
It’d suck the nips of a mother centaur,0.6766595289079229
Well boys. It’s a two front war now. It’s only a matter of time. ,0.3849036402569593
Ok fuck this judge. I read another thread about this case and all the comments were anecdotal stories about slutty opportunistic tween girls. I'm not saying they don't exist. It's just real fucking simple you don't  have sex with them and you don't pay for sex with them. Period. These are kids we are talking about not 30 year old women. ,0.9105995717344754
">In case you mean people in the middle of transitioning, then they should still be going to the bathroom of their original sex.

So what's stopping any man from saying ""I have a vagina"" (or ""I am in the middle of transitioning from female to male"") and waltz into the female bathroom to peep and jerk off?



",0.6879014989293363
"Yeah, Poppy is a war criminal who will never be punished. Doesn't mean all war criminals should escape punishment. That wouldn't make sense. ",0.5315845824411135
why is obesity not on the list? ,0.29764453961456105
To be honest I'd rather see some realistic sex in porn than try reenact things one sees in porn in reality.,0.5985010706638114
"The time has come. Previously on Dragonball Z my Sennheiser Momentum EI headphones stopped producing sound in the left earphone. I got a replacement under warranty within three days. Now it has happened again and I am in the market for new IEMs. I am looking still around the $100 price point but don't mind going a little over if there is a big change in quality. I loved my Sennheisers and they served me well. Somethings I'd like with my new ones are being able to be flush in my ear(like the shure earphones?), Replaceable cables would be nice, and of course the same or better sound quality than my Sennheisers. Thank you so much for your help",0.36456102783725913
"It's not going to happen, and the Republican mainstream isn't gonna replace Trump either.  No matter how many times you pinch yourself in the middle of the night, you're going to wake up to the harsh reality that one of these two superannuated assholes is going to be the next President of the United States.

edit typo",0.6900428265524625
"Well seriously, why not. I mean - maybe they were worried that if men and women were passing each other entering the bathroom men might say something inappropriate and offend the ladies, like 'sorry for the delay ma'am, takes a while to get that feller back under control once he's let out"" or something like that?  I don't know.... ",0.55406852248394
Someone complaining that a million dollars wasn't enough for a house in the school district they wanted their kids in. EYEROLL.,0.5444325481798714
"27. First job was working for my friends dad, who owned a flooring company. Got paid under the table, it was awesome.

First real job was selling shoes at Bass. ",0.31959314775160597
"No? It looks like shit and you can't see the images without clicking and there isn't a light theme. I get that there are flaws in the redesign, but why does nobody complain about the shit that is the old design?",0.8104925053533191
"Weirdly enough, i think about this fairly frequently. I would not hesitate to use my weak ass mouth to rip out the throat of an animal or human aggressor if my life depended on it. ",0.708779443254818
"I suspect that, even if we had advanced drugs and/or gene therapy that could avoid all the androgenic side effects, most women wouldn't want to be walking around with overtly masculine physiques, so I don't see this as a plausible scenario.",0.5117773019271948
"You really should go and read the story in full before you dig yourself an even deeper hole.

Hint: this app wasn’t in any store.

From the article:

*Instead, Facebook apparently took advantage of Apple’s “Developer Enterprise Program,” which lets approved Apple partners, like Facebook, test and distribute apps specifically for their own employees. In those cases, the employees can use third-party services to download beta versions of apps that aren’t available to the general public.* 

*Apple doesn’t review and approve these apps the way it does for the App Store because they’re only supposed to be downloaded by employees who work for the app’s creator.*",0.5203426124197001
"Look I know we suck and all, but every loss has been really close and that game was before we lost Rosen and others. TBH beating us in OT is a lot more respectable than getting taken to OT by Arizona even if you were on the road. I still think you're number four over A&M but not for that reason.",0.4534261241970021
"I mean, it is cool to have your tastes validated.  I was able to independently recognize the value in this before it became commonly accepted that it was good.

That's not an excuse to be a snob about it.  A moderate amount of pride without thinking the unwashed masses have spoiled what you like by liking it too will suffice.",0.44164882226980723
