text,y
"I'm not religious, but fail to see the purpose of this initiative. This isn't really isn't going to have any meaningful sort of tax revenue impact (because *most* churches don't make a ton of money), and the result of the initiative is really going to be just the closing down of a ton of small churches. Most of these churches - in my experience - provide assistance to the homeless, donate time to the community, and provide guidance to a lot of at risk youth, etc. 

I fail to understand what good your initiative will drive - can you explain? ",0.4202355460385439
8 mins and it’s my PR,0.11884368308351176
"**Movies/TV shows Corner**

Talk about movies or TV shows here!
",0.21948608137044967
You can see the autism creeping in from the band aid,0.5985010706638114
"No, it doesn't. Contraceptives should be available with no limitations to anyone capable of having sex. If pharmacies are only denying these services to people of a certain age (teenagers) then that would be discrimination based on age. There are laws barring minors from buying tobacco and alcohol, and for good reason. This is not the case for contraceptives. These are completely unrelated. Obviously age discrimination usually happens to older people, but to say it cannot happen to younger individuals is ignorant. ",0.4427194860813704
Just noticed that Sanji's eyebrow is opposite of his brother's.,0.2526766595289079
"My dad gets mad when he has to use an app on his phone to change the channels on the TV after ""someone"" misplaces the remote. He says, and I quote, ""I shouldn't have do do this crap, get my phone out and open an app just to change channels. This is ridiculous!"" I tell him all the time ""Do you even hear what you're saying? You are using an app on a PHONE to change the channels on a TELEVISION! You need to shut up and just do it, cause that's freakin remarkable!"" I swear it's like we've switched roles and now I'm explaining to him how it used to be back in my day...smh, it's awful.",0.5224839400428265
"A bit late to the party, aren't we? ",0.2639186295503212
">Not true.

>Deceleration is an object coming to rest due to the forces acting on it, not through the opposite of acceleration being applied to it.

>Gravity and friction are not -acceleration in reality. They are forces of their own.

Somebody call Einstein and tell him that acceleration and gravity *are* distinguishable! ",0.4089935760171306
"Di tempatku lineage2 sekitar 2,05gb. Awal download kemarin sih sekitar 1,8.",0.31959314775160597
"That's childish. I had to laugh. ""But I wannnnnnit!!!"" Whaaaaa. ""Give it to me nooooooowwwwww! (Snot bubble runs down chin/ feet stomping.)",0.4759100642398287
"Yes you should have told her to get an enema
",0.4759100642398287
"I'd be like "" LOL, I guess we shouldn't have raided Area 51 for the Big Tiddie Aliens."" Then I die",0.6097430406852248
"His argument was previously too vague. It would have encompassed research science without the edit, since all he specified was ""selectively breeding animals"".",0.4646680942184154
"If you need some builds to be performed, don't  hesitate to PM me :)",0.1638115631691649
Really enjoyed this format. This was the type of in-depth discussion the topic deserves. Happy to answer questions/comments on anything I said. ,0.24143468950749467
"Hopefully this is the beginning of a broader trend. 

I support personal freedoms, but not at the cost of putting the lives of innocent children or the greater public at risk. 

Science based medicine needs greater visibility and it is going to come from efforts like this.",0.4759100642398287
"Give him a map of Canada, see how it goes",0.3849036402569593
"The two next major elections are pretty pro-EU. Merkels biggest rival is more pro-EU than her (but the CDU currently still has a slight lead over the SPD) and the current projections of the French election have Macron winning, who is more pro-EU than Hollande. ",0.3752676659528908
"I'd sell it and enter semi-retirement, working a 'fun' part-time job",0.19700214132762311
"Do you have this same feeling with prescription meds? Someone has trouble in social situations/anything really for whatever reason, takes x substance (let's assume ""safe""amount) and finds it works wonders for them? 

",0.3618843683083512
"The fact that this doesn't help in ALL cases isn't sufficient to not do this.  Obviously it won't end school shooting, but if it prevents some portion of cases it seems reasonable.  Same thing with gun control, the argument isn't that it will stop all violence, just some of the gun violence.",0.4534261241970021
God dammit Al I wanted to watch you fight.,0.6097430406852248
How would you know if they’ve had casual sex? ,0.5315845824411135
"I like having sex with men and I occasionally hook up with a guy; for free, of course. If I could charge men to have sex, I'd gladly do it. I'd have sex more often, and I'd make a lot more money than my day job. So from my perspective, prostitution is illegal because men expect their sex to be free. Allowing us to charge for sex would allow women to have a lot more financial power over men. Patriarchy won't allow that.",0.6156316916488221
"As a Jewish person, I’ve shared Jewish food with non-Jewish people dozens of times, while explaining some of the history and origins of the food or custom. It’s great to share cultures with people. But if someone just starts taking Jewish customs without knowing anything about the background, they aren’t adopting the culture. They’re diluting it. They’re making it less meaningful. The Jewish people have been oppressed for thousands of years. People have attempted to completely destroy Jews and Jewish culture for millennia, and taking aspects of Jewish culture without any appreciation for the context of that culture isn’t flattering; it’s diluting and erases the larger meanings behind the culture, which only serves to take away from the Jewish people even more.",0.5428265524625268
"Well, that would be because 'pro-life' is about controlling women's bodies, not defending innocent life, and all of the arguments used in defense of their stance are fabricated.",0.5117773019271948
"Didn't confession begin as an open, village-level ceremony where people publicly aired their grievances in a spirit of communication and forgiveness?  Turning that into a closed doors, one-on-one ritual of handing regular kompromat to the authorities was never going to end well, and Pius X mandating that confession should begin at the age of seven turned a mistake into a disaster.",0.6097430406852248
"I am also a libertarian, and am currently registered as a Republican. While I agree that the majority of the party no longer shares my interest, the Republican Party has a Liberty Caucus, which holds my view closer than any major party. The reason I still justify being a Republican on paper is to vote those Caucus members in to try and help reshape the party to being pro-liberty again.

Don't worry about the whole party, the Liberty Caucus is the best place for liberty in America. ",0.487152034261242
"I haven't dated since 1983.  We went out to eat (at a campus cafeteria LOL), ended up back in her dorm room where we talked all night.  And no, the sex didn't start until a couple weeks later.  Mostly we talked.  ",0.43147751605995716
"Note to self:  Avoid Westminster if visiting London.

&#x200B;",0.36456102783725913
I bumped into Martin O'Malley once. At least I think I did.,0.31959314775160597
Balto didn’t do shit and can go fuck himself,0.9443254817987151
"Yes, Tibbetts is definitely the only victim of a crime committed by an illegal alien. Also, what literature do you personally use as reference when someone questions the efficacy of gun control? What specific policies do you want to see in relation to both immigration and gun control (as both where mentioned in your graphic)?",0.44164882226980723
"hahaha, i'm sure you're a really tough, brave person IRL. Why would I? So you can try and ruin my life cause you're a pathetic excuse for a person? Cause you're a disappointment to your parents and this is how you find joy? Why the fuck would I do anything some pitiful little faggot like you tells me to do?",0.8886509635974303
"I really like how this post has changed from CMV to ""shit on the racist, xenophobic, transphobic, homophobic, (...) cunt! He's a bigot! I'm going to put words in his mouth!""

I think I'll stop replying to comments like yours from now. ",0.794967880085653
"First off I'm %100 vaccinate your kids. But when this came out it was marketed as a vaccine for cancer, not as a vaccine for an STD. 

I do understand that some people think that teens don't have sex so they don't need it.  

I also get it that if they had of said ""Hey Dumbass your kids are going to boink like bunnies protect their crotches"" they wouldn't have sold as many.",0.6879014989293363
"I don't know, you did just give them the advice they needed to hear, and you are from reddit. Going to a therapist is the best advice they could be given.",0.4202355460385439
"The way I see it, the depth of Conway's utter cluelessness represents a profoundly telling echo sounding of the trump administration's overall ineptitude.",0.5203426124197001
"Good riddance. But to be fair, think of this as a holiday for them. Clownstick von Fuckface wil let them back in.",0.7103854389721627
They vote directly using proportional representation. That allows smaller parties to exist.,0.28640256959314775
"Well everyone's different. Like I said it's just too fine of a line. If the girl was passed out, and the guy was stone cold sober, he could easily get away with saying she consented and is just regretting it after the fact. It's fucked up. I'm single, and kinda scared to meet women at bars for this reason. ",0.6622055674518201
"""We cannot scientifically test the existence of God"", is a claim.

How do you propose we test it?",0.487152034261242
"Some of the more female-friendly porn includes laughter, which is nice, but that shit is absent from all the gonzo reality porn and I'm pretty sure I've shared laughter with my partner every time I've ever had sex. ",0.8104925053533191
"I would call all of them anti vaxxers, most of then just haven't had their vaccinations yet.",0.4089935760171306
"Okay I should have mentioned that I'm talking about people that are using them unironically to make fun of others, but not about those that ironically describe themselves that way. ",0.36456102783725913
"Really? I thought I did a shitty---or at best, less than mediocre---way of putting it.",0.6579229122055674
"What do these people actually want to achieve? Ban contraception, get more abortions. Ban abortions, get more unwanted children and teenage parents. Because going back to everyone having 8 children is a totally great idea. I just don't get their logic. I can understand their ethical issues, but if they take a realistic look, what is their endgoal? They must be aware that people aren't just gonna stop having sex. ",0.642933618843683
That was not UKIP. That was the official Brexit campaign.,0.28640256959314775
"There is a shit tone of professional research on the issues surrounding masculinity and masculine ideals. There are a bunch of books available on the subject too. 

It is not mainstream because men have no movement equivalent to feminism and some feminist writers see being male as a solely positive experience. 

If you want to learn about that stuff a book to start with is Masculinities by R. W. Connell. They are considered the top authority on masculinity in the world. 

If you want me to share more info reply and I'll grab more book names and authors.",0.6097430406852248
Pro-cop propganda. Remember how the enemy is. ,0.4759100642398287
"5:59

Never been below 6.  It was my goal. 

Did 10.1 out of the gate and kept it with plan to go all out with 30 seconds to go.  Figured the extra .1 over the course of 5:30 would make up for the spin up time on the treads - it didn’t.   Last min was an all out dash to the death.  Can’t believe the margin to just get it.  Need to buy a lotto ticket and some ice for my legs lol.",0.29764453961456105
"Well, there is only one way to REALLY find out!",0.21948608137044967
Who can name the famous black pastor that didn’t get charged for his tax evasion because of his race?,0.6541755888650963
"No, it's because this data is from the Metropolitan Police, whereas the City has its own police force.",0.3276231263383298
"way too early.  If youre not ready to join now, no need to say hello to us yet.",0.30888650963597425
Way to kill the hype! Technical issues every week!,0.487152034261242
The majority of Europeans do realise that he's seen as a vile slimey little shit by many in Britain and that were not all Farage supporters right? ,0.7323340471092076
Basically every A Day To Remember song if I’m remembering correctly. You could do ‘something you’re the hammer...’ which is pretty fun if you’re into that kinda music,0.19111349036402567
"Okay, I live in KS and I am trying to look up where I can vote on this. The 3 kansas websites I've pulled up have either been outdated or provide no information. Could a fellow Kansan help out?",0.28640256959314775
But vaccines cause autism Grandpa 😵,0.5428265524625268
We should never get used to it. It deserves to get mocked all the way until he's removed one easy or the other.,0.487152034261242
"For most guys, replace 'expect' with 'hope.'",0.31638115631691643
"A win is a win, go blues!",0.06316916488222703
Camel meat is actually pretty commonly eaten in the middle east.,0.29764453961456105
"Michigan, Clemson, or Washington will be outside the top 4 for either Louisville, Ohio State, or Texas A&M",0.22537473233404712
Where did i say they bring no value? Sure they bring in money but it can take decades to recoup those costs while the private companies are the ones raking in the profits. ,0.40738758029978583
"Just as much as any other profession that provides a service, just because society has a stigma attached to sex work doesnt mean you're any less of a human being that deserves the same level of respect that you give. ",0.6766595289079229
"> Muslims are the extremists, not men or military aged people. 

So you have no problem labeling the 1.6 billion people that follow Islam as being extremists, but when it comes to labeling the 3 billion people that are male as violent...that's just a bridge to far?

Refusing service to men because of the remote possibility that they may become violent is stupid.  You agree it's stupid.  But when talking about the even more remote possibility that someone who's identifiable as Muslim may become violent....that's a real threat.",0.7767665952890792
"I totally agree with everything you’ve said. In college (in retrospect) there were a lot of guys who were my friends. Years later when I got married and they all disappeared, I figured out that they weren’t there to be my friends, before that I had no clue. 

To all you guys out there, being “friends:” Tell the object of your affection, ask them out. Women are not mind readers. The most attractive quality in a person is being attracted to you. Many of those guys could have been in a relationship with me back then but seemed interested in only being my friend.",0.36456102783725913
"Your country already spends more than any other, more than at least the next 10 most well funded militaries, and you want to increase that spending under Trump? Your military is the world's largest welfare state. So many millions of people ""employed"" with tax payer money, spent on taking apart tanks and putting them back together dozens of times in some fucking factory in Indiana...",0.7018201284796574
You’re being sarcastic and contributing nothing. If you agree with OP don’t post.,0.49839400428265523
I went on a date from an online dating site and my date found out I was Jewish.  She spent the next 30 minutes going off about how much she didn't trust the Jews.,0.6766595289079229
"Board games: Risk, Life, Monopoly, chess, checkers.

I wish I could remember half the card games I used to play. Need a book of those for relevant occasions.",0.2526766595289079
"If you've never been on call it's easy to dismiss it but it's not like your brain is turned off. You're jumpy, you don't sleep well, you can't do so many things. You have to even shower quick if your place is demanding, mine required me to be in within 20 min and I lived 10-15 away. 

Sure, if you're a senior clinician with years under you, on call is much less stressful because you've got interns and residents to handle all that bullshit. ",0.5765524625267665
Guys I'm horny do your thing please,0.7323340471092076
"I think it comes down to states and who's available. I know Wolf-Pac and Amend the fourth are both pretty big on local fronts; but are rarely in the news because they fight on convincing local representatives to support bills to get money out of politics. I know there are others; but it comes down to your state and what progressive organization you have in the area. Unfortunatley it comes down to personal research. However, with Our Revolution if they build the site up right to include all local progressive organizations things might be easier for people to hear about them. ",0.3977516059957173
Confusing—who was suing whom over what?,0.30888650963597425
"The problem is that you are making a blanket statement of Jews. Jews do not all think one way, I know because I live in a ginormous Jewish community.",0.5091006423982869
"Beer is cool and all, but you know what I really like?

Being alive. Totally underrated IMO.",0.31959314775160597
" I’ve never had chicken pox, and now I gotta get the vaccine again in August oof",0.21948608137044967
"SOME roads have tolls. The vast majority don't. And hospitals are a bad example because they're such a complicated mess with where money goes, comes in from, pricing, etc. 

I haven't seen a single local public park in my area that charges money. The exception are some state parks and that's only for parking. ",0.36456102783725913
Crazy guy? No. Crazy girl. ,0.6322269807280514
"Man, that would be fucking hilarious if Mueller dragged Giuliani in for questioning and possible money laundering charges.

I wonder if Giuliani would claim attorney-client privileged.  I wouldn't put it past him to try and pull a ""Mooch"".",0.8217344753747322
"Look at San Diego.

The city was still paying off the latest round of improvements the team extorted them into playing when they started threatening to leave if they did not get a new stadium downtown.

The city then wasted millions on planning trying to figure out how to pay for the stadium.

In the end Spanoa admitted it is all to puff up the value of the team so he can sell it soon. He was going where ever a city was willing to pay for his stadium. Now a new city is on the hook.",0.4759100642398287
"Breastfeeding prevents illness in infants too young for inoculation due to antibodies in the mother’s milk. By your same argument, parents of formula-fed babies who die of common disease should be prosecuted, since donor milk is available, unless parents can prove that the baby can’t have breast milk for medical reasons. 

Of course this is ridiculous! And I’m not arguing it. But it’s in the same vein as your argument because breastfeeding does protect young babies and children. ",0.38650963597430404
Truly staggering foolhardiness. If only there was a way for Trump and others like him to learn what such reckless ignorance would earn them without condemning the rest of the world.,0.5101713062098501
Over threw 20+ democratically elected governments. Supported leaders committing mass murder. Destroyed dozens of innocent countries for oil profits. Fund and support terrorists. Sold weapons to both sides of the conflict so they would destroy them selves. Sold chemical weapons to tyrants and instructed the tyrants where to use them. Oh god I can go on forever.  ,0.5765524625267665
The analogy is that having respect for a casual activity doesn't mean you automatically have to respect someone making a career out of it.,0.38650963597430404
"They did it to increase ad revenue.  The goal is to keep you on reddit as much as possible.  Before the redesign, when you clicked a link it would take you to the hosting site (imgur, gfycat) and reddit would lost that ad revenue.  Now, a lot of these links are opened within reddit which gives to ad revenue back to reddit.

I hate the redesign, but it makes sense why they did it.  They were driving traffic away from reddit and to other sites for a long time.  User experience is just an afterthought.",0.4534261241970021
"I think this is true. I think you’re right. Morality and ethics are restraints. People can better achieve their goals if they use a strictly rational strategy. For one instance, I’m surprised that so few women engage in sex work. There is a LOT of money in sex work. An average-looking woman can easily earn $50,000 per year untaxed. 

However, many people are unable to function without moral principles. Many women *could* engage in sex work, but most women have personal values which would cause them too much cognitive dissonance if they were to engage in sex work. 

Likewise, many people are mentally incapable of discarding their moral principles for money.",0.6097430406852248
I can't beat phase 2 for shit. Fuck this game and the sadistic bastards that made it lol. I hope they have diarrhea for the rest of their life!,0.8998929336188437
You actually don't have to mark them. The goal is to click all the non mine squares,0.3618843683083512
"Not entirely on topic, but there is a huge food supplier in the North Eastern USA who for a long time donated (non-rotting, still good) food to a local food bank.

Until one day when a batch of something wasn't cooked correctly and went bad before it was served at the food bank. Unfortunately neither the food bank, nor the supplier caught this and the food was served. Many people got sick and some greedy, pushy lawyer sued the food supplier for some ridiculous amount ""on behalf of the sick folk.""

So now the supplier saves itself money by transporting all leftover food to either be sold and burned at a power plant or to be dumped.",0.487152034261242
Jesus fuck fox is dumb,0.9657387580299786
Someone complaining that a million dollars wasn't enough for a house in the school district they wanted their kids in. EYEROLL.,0.5444325481798714
"A lot of metal core is in Drop C. 

August Burns Red’s songs are pretty tricky, but tons of fun to play.

A lot of Periphery’s 6 string songs are in Drop C as well.

Veil of Maya have a lot of songs in Drop B, if you can go lower.",0.30888650963597425
"vegetarianism. atheism. any other -ism where the person claiming it won't shut up about it

multiple divorces, probably, although that depends on the circumstances. murder convictions, stuff like that. 

the main thing i look for is intelligence and a sense of humor, i can work around most anything else but total loony tunes stuff like the above would be hard to deal with. 

",0.5315845824411135
"My last relationship was a open relationship, so this sounds fkn awesome.",0.3977516059957173
"OH YES

I think a good 30% of my victories consisted on tricking blood thirsty hosts and phantoms to jump after me and die in the process.",0.49839400428265523
I was reading this like “Doctor Who” linked vaccines to autism and was thinking “Wow that show really is going downhill.l,0.6209850107066381
Then how else are you supposed to make money to do things/get anywhere?,0.23661670235546037
">Leading Britain off a cliff and cheating their own people while they are at it.

It's almost as if these leave-voting money-grubbing pro-business Tory leaches know how much easier it will be to fuck everyone over without the EU getting in the way.",0.8217344753747322
You spelled ~~bidet~~ enema wrong.,0.4646680942184154
"I'm not happy about it, but its good to hear i'm not the only one.  
  
Never liked the game, but tbh i dont know why. It looks better than ffbe.",0.36456102783725913
One underrated benefit: the new ability to cycle through posts using the ‘N’ key is very useful for erm... one-handed use.,0.38650963597430404
"Nah, CB used to lean conservative, not reactionary racist,sexist, etc. ",0.5214132762312633
Attack attack parry attack attack parry. Not that difficult of a boss,0.4202355460385439
"My second point was this. If my non-vaccinated child gets an at risk child (one that cannot medically vaccinate) sick, am I now liable for their death as well?",0.4089935760171306
"Need to save the earth from an asteroid that would destroy everything you love? Then work these hours, otherwise, take care of yourself.",0.4089935760171306
Does anyone have the link to this? I want to congratulate the father.,0.1300856531049251
I just here to see how many people call out this post being kinda historically inaccurate. There was a Balto that did run the last leg of the run to get the medicine to those children. There were other dog teams and Balto didn't even run the longest stretch.,0.3752676659528908
Is...is that Ed from BNL?,0.28640256959314775
Wait whoa whoa whoa what the fuck what the fuck ,0.8715203426124197
"Simpsons Hit & Run

Still the best GTA game. Fight me.",0.3420770877944325
"Fuck yea dude

I'm down with the fucking swirl.",0.8217344753747322
